"name","school","subschool","descriptor","spell_level","casting_time","components","costly_components","range","area","effect","targets","duration","dismissible","shapeable","saving_throw","spell_resistance","description","source"
"Reinvigorating Wind","enchantment","compulsion","air, mind-affecting","bard 2, druid 3, shaman 2, witch 3","1 standard action","V, S, M/DF (a flower petal)","0","30 ft.","cone-shaped burst","","","instantaneous","0","0","Will negates (harmless)","yes (harmless)","You exhale deeply, creating a gentle magical wind that invigorates any allies in the affected area, as follows. Any sleeping allies immediately wake up. Fascinated allies are shaken free of the fascinate effect. Flat-footed allies no longer count as flat-footed even if they have not acted yet. The duration of effects that cause any allies to be confused, frightened, paralyzed, slowed, or stunned is decreased by 1d4 rounds (roll separately for each target). If the duration of any such effect is reduced to 0 rounds or fewer, the effect ends for that ally. Finally, any allies lying prone may stand up as an immediate action, provoking attacks of opportunity as normal.","Villain Codex"
"Steady Saddle","transmutation","","","antipaladin 1, druid 1, paladin 1, ranger 1","1 standard action","V, S, DF","0","touch","","","saddle touched","1 minute/level (D)","1","0","Will negates (harmless, object)","yes (harmless, object)","A saddle affected by this spell becomes more comfortable to sit in, and the magic stabilizes any shaking motion caused by riding at a high speed. For the duration of the spell, the penalty to use ranged weapons while mounted in the target saddle decreases by 2. This stacks with the benefit of the Mounted Archery feat and similar effects. Furthermore, the DC for any concentration check required as a result of the mount's movement decreases by 2.","Villain Codex"
"Wicker Horse","conjuration","creation","","occultist 2, shaman 2, summoner/unchained summoner 2, witch 2","10 minutes; see text","V, S, M/DF (a reed or twig)","0","touch","","a horselike wicker construct","","1 hour/level (D)","1","0","none","no","Reeds, grasses, creepers, or thin tree branches (your choice) that you touch animate, twisting and bending to form a wicker horse complete with a riding saddle. The object is animated, but retains a wickerlike appearance.  A wicker horse has the statistics of a light horse or a pony, except it gains construct traits and counts as both an animal and a construct for the purposes of spells and effects. It gains a number of extra hit points equal to your caster level. It has no skills or feats except as noted below.  A horse made of reeds gains a number of Swim ranks equal to your caster level. A horse made of grasses gains the Run feat and a number of Acrobatics ranks equal to your caster level. A horse made of creepers gains a number of ranks in Climb and Stealth equal to your caster level. A horse made of tree branches is continually affected by barkskin, as cast by a magic-user with a caster level equal to yours.  The wicker horse does not follow any commands given with the Handle Animal skill, and only you can ride it. You can cast this spell only in an environment where suitable plant material is available. When the spell ends or the horse loses all its hit points, the horse falls apart.","Villain Codex"
"Book Ward","abjuration","","","bard 2, cleric/oracle 2, sorcerer/wizard 2","1 standard action","V, S, M/DF (a drop of clear oil)","0","touch","","","one touched object of up to 10 pounds/level","1 day/level or until discharged (see text)","0","0","Will negates (harmless, object)","Yes (harmless, object)","As protection from energy, except as noted above and that the spell only protects against acid and fire damage. While the energy protection remains, the item is also completely waterproof (this protection extends to other liquids as well, such as alcohol and oil).","Seekers of Secrets"
"Questing Stone","divination","","","bard 4, sorcerer/wizard 4","10 minutes","V, S, F","0","touch and unlimited","","","one ioun stone touched","1 minute/level (D)","1","0","none","no","This spell functions like arcane eye, except that it uses an ioun stone as a visible scrying sensor. The ioun stone moves at the same rate as an arcane eye, and may pass through holes or spaces as small as 2 inches in diameter. It can enter another plane of existence using a gate or similar portal, but the caster loses contact with the sensor should this occur. The enhanced ioun stone has AC 24, 10 hp, hardness 5, fly speed 30 (perfect), and a +16 Stealth bonus. The stone does not provide you with its normal benefits while you are using it as a scrying sensor.","Seekers of Secrets"
"Revelation","divination","","","bard 2, cleric/oracle 3, sorcerer/wizard 3","1 round","V, S","0","personal","","","you","1 round/level; see text","0","0","","","You gain a brief understanding of the workings of a single puzzle, device, or trap, gaining an insight bonus equal to your caster level (maximum +10) on checks to disable, manipulate or solve the object in question. Your insight is ineffable; you are unable to communicate your understanding to others.  At the GM's option, this spell may instead give you a clue or other piece of useful information. In this case you may communicate the clue to others and retain knowledge of it after the spell's duration has expired.","Seekers of Secrets"
"Scrivener's Chant","transmutation","","","bard 0, cleric/oracle 0, sorcerer/wizard 0","1 standard action","V, S, M (fine sand and a vial of ink)","0","5 ft.","","","one or more written objects","concentration, up to 1 minute/level","0","0","Will (harmless, object)","yes (object)","This spell imbues a quill with animate energy and rapidly transcribes words from one page to another. The quill copies a written work at the rate of one normal-sized page per minute.  The Linguistics skill can be used to make a convincing copy, but otherwise the reproduction is written in the hand of the caster.  You must concentrate upon the material being duplicated for the spell's duration and provide new blank pages as required.  The scrivener's chant requires blank paper and a quill or other writing materials, in addition to the material components.  This spell cannot duplicate magical writing (including spells and magical scrolls), though it can duplicate non-magical writing from a magical source.","Seekers of Secrets"
"Cursed Treasure","necromancy","","curse","antipaladin 3, bloodrager 4, cleric/oracle 3, shaman 3, sorcerer/wizard 4, spiritualist 3, witch 3","1 minute","V, S, M (a platinum piece)","0","touch","","","unattended object touched","permanent until discharged, then permanent (see text)","0","0","Fortitude negates (object), then Will negates (see text)","yes (object), then yes (see text)","You touch a piece of treasure or container filled with treasure and place a terrible curse upon it, choosing from any option available with bestow curse. The next creature to take the treasure or remove items from the container is affected by the curse, unless it succeeds at a Will save (spell resistance applies). If you are the next creature to take the treasure or get objects from the container, though, the spell discharges harmlessly instead.","Villain Codex"
"Rotgut","transmutation","","","antipaladin 2, bard 2, cleric/oracle 2, inquisitor 2, occultist 2","1 round","V, S, M (a pinch of hops)","0","close (25 ft. + 5 ft./level)","","","1 gallon of water/level","instantaneous","0","0","Fortitude negates (object)","yes (object)","You transform the target into a cheap alcohol of your choice, such as beer, grog, mead, rum, or wine. The alcohol doesn't taste good, but it's drinkable and just as effective as normal alcohol in making creatures inebriated (Pathfinder RPG GameMastery Guide 237). This spell doesn't work on holy water, potions, magical liquids, or water that is part of a creature.","Villain Codex"
"Walk The Plank","conjuration","creation","","sorcerer/wizard 5, summoner/unchained summoner 5","1 standard action","V, S, M (a shark tooth and a splinter of a ship's hull)","0","close (25 ft. + 5 ft./level)","","20-ft.-by-20-ft. hole, 10 ft. deep/4 levels","","1 round plus 1 round/level","0","0","Reflex negates (see text)","no","This spell functions as per create pitAPG, except as noted here. All but the top 10 feet of the hole is filled with saltwater, reducing the fall damage for anyone falling into the pit to 1d3 points of nonlethal damage and allowing Huge or larger creatures at the water's surface to simply pull themselves out of the pit as part of a normal move action, without a Climb check. Additionally, the pit contains a single advanced shark (Pathfinder RPG Bestiary 294, 247) for every 4 caster levels you have (maximum four advanced sharks). If desired, when you cast the spell, you can substitute two of the summoned sharks for one great white shark (Pathfinder RPG Bestiary 4 241). These sharks immediately attack any creature that falls into the pit, even you. If multiple creatures fall in the pit, the sharks attack randomly. When the spell ends, creatures inside the hole rise up with the bottom of the pit, as normal for create pit, but the conjured water and sharks vanish.","Villain Codex"
"Hobble","transmutation","","","bard 1, bloodrager 1, inquisitor 1, magus 1, mesmerist 1, ranger 1, sorcerer/wizard 1","1 standard action","V, S, M (a drop of glue)","0","close (25 ft. + 5 ft./2 levels)","","","one creature/level, no two of which can be more than 20 feet apart","1 round/level","0","0","Fortitude negates","yes","This spell disrupts the method a target uses for movement. Creatures under the effects of this spell move at half their base speed (rounded down to the nearest 5-foot increment) but can still take 5-foot steps as normal. Incorporeal creatures and creatures flying with perfect maneuverability are immune to the effects of this spell. Each round, a target receives another save to end the effect.","Villain Codex"
"Hoodwink","enchantment","compulsion","mind-affecting","bard 2, medium 2, mesmerist 2, occultist 2, sorcerer/wizard 2, psychic 2","1 standard action","V, S, M (small piece of black cloth)","0","close (25 ft. +5 ft./level)","","","up to one creature/level, no two of which can be more than 30 ft. apart","1 hour/level (D)","1","0","Will negates","yes","You befuddle the targets' senses, preventing the targets from clearly perceiving their surroundings.  Instead, hoodwinked creatures see only the roughest shapes and details and hear only muffled noises. However, targets can clearly hear verbal communication from the spell's caster. This spell does not impart understanding of the caster's language if the creature can't already understand it. Other than to hear the caster speak, targets automatically fail Perception checks with DCs greater than 5, and they are too disoriented by the spell to accurately remember the path they took while under its effects.  While under the effects of this spell, targets without the help of a guide move at half speed, and any attacks they make are treated as though the creature they are attacking had concealment. Moving faster than half speed requires targets to succeed at a DC 10 Acrobatics check. Those that fail this check fall prone. If the target is attacked or physically harmed by any creature other than another target of hoodwink, the spell's effect ends immediately for that target only.","Villain Codex"
"Geomessage","illusion","figment","","bard 3, medium 3, occultist 3, ranger 3, sorcerer/wizard 4","1 minute","V, S, M (a scrap of vellum)","0","touch","","","surface touched","1 day/level","0","0","none","no","You create a written message of 50 words or fewer, or else an image, a drawing, or a similar diagram. The figment hangs invisible and obscured upon the target surface for the duration of the spell. Another casting of geomessage is needed to cause the figment to arrange itself into the intended message.  When you cast the spell, you can choose to incorporate a passphrase into the spell. If you do so, the message is protected as if nondetection had been cast on it for the full duration of the spell, though creatures that cast geomessage on the surface and speak the passphrase ignore the nondetection effect and cause the image to become visible until the caster speaks the passphrase again.  Without a passphrase, the message simply remains invisible to those who cast geomessage. Detection methods like detect magic and see invisibility indicate the message's presence but do not reveal its contents.","Villain Codex"
"Protection From Spores","abjuration","","","alchemist 2, cleric/oracle 2, druid 2, ranger 1, shaman 2, witch 2","1 standard action","V, S","0","touch","","","creature touched","1 minute/level","0","0","Fortitude negates (harmless)","no","With a touch, you bolster a creature's body to protect it from the harmful effects of spores and similar afflictions. While under the effect of this spell, a creature is immune to the effects of brown mold, green slime, russet mold, yellow mold, and any similar hazard, provided the hazard is CR 6 or lower. Similarly, the creature is immune to poison, disease, and infestation attacks from all fungal creatures of CR 6 or lower, including  effects such as basidirond spores, violet fungus rot, and the like. The target is immune to fungus-based toxins, such as striped toadstool. Against similar hazards or monsters of CR 7 or higher, the target gains a bonus on all saving throws against the effect equal to half your caster level. Protection from spores offers no protection against fungal infestations created by the seeded, by the spell what grows within, or by Xhamen-Dor.","AP 113"
"What Grows Within","necromancy","","evil","bard 6, cleric/oracle 6, druid 6, mesmerist 6, psychic 6, sorcerer/wizard 6, witch 6","1 swift action","V","0","personal","","you","","1 round/level","0","0","see text","no","By speaking the name ""Xhamen-Dor,"" you infuse yourself with the essence of the Inmost Blot and gain a +3 profane bonus on Will saving throws for the spell's duration. When you prepare what grows within for the first time, or the first time you use it via a spell-completion or spell-trigger item, you can thereafter be targeted by Xhamen-Dor's infected dreams ability (see page 86). As long as you are under the effects of what grows within, your mind-affecting spells carry this supernatural taint within them and can infect those who succumb to those effects. Whenever you successfully affect a creature with one of your mind-affecting spells (this requires the target to fail its saving throw against the spell if the spell allows a save, but automatically affects a target if the spell does not allow a saving throw), that target must also succeed at a Fortitude saving throw against what grows within or it immediately becomes afflicted by a lesser version of Xhamen-Dor's seeded infestation. This infestation does not expose the victim to Xhamen-Dor's infectious dreams, but it can ultimately  result in that creature's transformation into one of the seeded. Each time you affect a creature with what grows within in this manner, the remaining duration of what grows within is reduced by 1 round. If you affect multiple creatures in a round, you choose the order in which they must save against the effects of what grows within, and reduce the spell's remaining duration by 1 round each time one of them is affected by the infestation.  Lesser Seeded Infestation-save Fortitude DC = spell's save DC; onset immediate; frequency 1/day; effect 1d4 Constitution drain; cure none. This infestation can be cured by magic alone. A creature whose Constitution is reduced to 0 by this infestation dies and rises from death in 1d4 rounds as a seeded creature (see page 90). This is an infestation effect.","AP 113"
"Litany Of Truth","divination","","language-dependent","inquisitor 6, paladin 4","1 swift action","V, S, DF","0","close (25 ft. + 5 ft./2 levels)","","","one creature","1 round","0","0","Will negates","yes","With a tirade against deceit, you strip the target of any illusions cloaking it. Any illusion spells or effects affecting the target are suppressed for the spell's duration. In addition, the target can't benefit from concealment.  While subject to this spell, the target cannot be the target of another spell that has the word ""litany"" in the title.","Qadira Jewel Of The East"
"Balance Of Suffering","conjuration","healing","death","cleric/oracle 6, inquisitor 6, occultist 6, shaman 6, spiritualist 6, witch 6","1 standard action","V, S, DF","0","close (25 ft. + 5 ft./2 levels)","","","one living creature and another single living or undead creature","instantaneous","0","0","Will half; see text","yes; see text","You borrow life force from a living creature and infuse it into another living creature, potentially wreaking destruction on the former and bolstering the life of the latter.  Choose an initial target, which must be alive, and a secondary target, which must be alive or undead. The initial target is dealt a number of points of damage equal to 9d6 + 1 point per caster level. A successful Will saving throw halves the damage dealt. The target might die from damage even if it succeeds on its saving throw.  If the secondary target is a living creature, it regains a number of hit points equal to the amount of damage taken by the initial target. If the secondary target is undead, it instead takes an amount of damage equal to that dealt to the initial target. The secondary target can halve the healing imparted or harm inflicted to it with a successful Will saving throw (although a secondary target receiving healing can forgo this saving throw as normal).  This spell is subject to the spell resistance of the initial target; if the secondary target is unwilling, this spell is also subject to the secondary target's spell resistance. If the spell does not penetrate the initial target's spell resistance, it fizzles with no effect. If it does not penetrate the secondary target's spell resistance, the initial target is still harmed as described, but the secondary target is not healed or harmed.","Healer's Handbook"
"Curative Distillation","conjuration","healing","","alchemist 2, cleric/oracle 3","1 standard action","V, S, M (healing herb, alchemical remedy, or potion of a healing spell worth at least 50 gp)","1","touch","","","one living creature touched","instantaneous","0","0","Will half (harmless)","yes (harmless)","You concentrate the healing potential of the material component so that it's exceptionally potent and restorative. This spell restores a number of hit points equal to 1d8 + 1 point per caster level (maximum +10) to the target, and also grants the target the benefits of the material component. Roll the hit points restored separately when determining how many total hit points this spell and the material component restore.","Healer's Handbook"
"Healing Flames","conjuration","healing","fire, good","cleric/oracle 4, inquisitor 4, paladin 4","1 standard action","V, S, DF","0","","10-ft.-radius burst, centered on you","","","instantaneous","0","0","Reflex half; see text","yes","You unleash a blast of holy flames that washes over all creatures in the area in a glorious display of divine power. This deals damage to evil creatures and heals good creatures in the area. The amount of damage dealt and the number of hit points restored in each case is 1d8 points per 2 caster levels (maximum 5d8).  Half of the damage this spell deals to evil creatures is fire damage, and half of the damage is pure divine power that is therefore not subject to reduction by energy resistance to fire-based attacks.  Neutral enemies within the spell's area of effect also take the fire damage, but do not take the divine damage. Neutral allies within the area are healed by half as much as good creatures. A successful Reflex saving throw halves the damage taken in all cases.","Healer's Handbook"
"Healing Token","conjuration","healing","","cleric/oracle 2, druid 2, inquisitor 2, paladin 2, ranger 2, shaman 2","1 standard action","V, S, DF","0","touch","","","one touched holy symbol per 3 caster levels","10 minutes/level","0","0","Will negates (object)","yes (object)","You imbue one touched holy symbol per 3 caster levels with a connection to your own divine power, turning the touched holy symbols into tokens of healing. Each of the targeted holy symbols can represent any deity regardless of the deity's actual alignment.  As long as you wear or carry your divine focus, any creature carrying a token of healing can make a plea for healing in a language you understand as a standard action. When they do this, you are silently alerted to the plea for healing and can magically heal the target as an immediate action anytime before the end of your next turn.  The magical healing you use to do this can be either a supernatural ability that heals damage (if you have uses available) or a spell or spell-like ability that belongs to the healing subschool (if you can cast any). In either case, to use the ability or cast the spell through this spell, you must be able to include or target that creature, and the ability's activation time or spell's casting time must be no longer than one standard action.  If the ability or healing spell you use through a token would affect multiple creatures, such as mass cure light wounds, the ability or spell affects the creature that pleaded for healing as well as any other creatures within the healing spell's normal range that are also holding a holy symbol imbued with this spell.  So, for example, when you use mass cure light wounds through a holy symbol that has been turned into a token of healing, that spell would heal the creature holding the token that pleaded for healing as well as one creature per level that is also holding a token (no two of which can be more than 30 feet apart). However, the mass cure light wounds spell would heal only creatures within range that are holding tokens.","Healer's Handbook"
"Inspiring Recovery","conjuration","healing","mind-affecting","cleric/oracle 6, inquisitor 6, paladin 4, ranger 4","1 standard action","V, S, DF","0","medium (100 ft. + 10 ft./level)","","","one target creature and all its allies within 60 feet; see text","instantaneous and 1 minute","0","0","Will half (harmless)","yes (harmless)","You can heal a creature, harm an undead creature, or call upon a very recently dead creature to fight beyond death's reach. The target creature regains 1d8 hit points per 2 caster levels (maximum 10d8).  This healing can even bring back to life creatures that have been dead within the previous 1 round (but they cannot have been dead for any longer). If you apply this spell's healing to such a creature and its hit point total is at a negative amount less than its Constitution score, it comes back to life and stabilizes at its new hit point total. If you awaken a dead creature in this way, all allies of that creature within 60 feet who can see it regain consciousness gain a +2 morale bonus on attack rolls, damage rolls, and saving throws for 1 minute thereafter, as the healing powers of your deity have imbued them with renewed vigor.  Creatures killed by death effects cannot be revived this way. This spell deals damage to undead creatures rather than curing them, and it cannot bring them back to life.","Healer's Handbook"
"Purify Body","conjuration","healing","","alchemist 4, cleric/oracle 4, medium 4, paladin 4, psychic 5","1 standard action","V, S","0","touch","","","living creature touched","instantaneous and 1 hour or until discharged","0","0","Will negates (harmless)","yes (harmless)","You align the target's chakras and soothe any unwanted imperfections found within its physical form, leaving its body pristine and without any pain or weakness.  You restore a number of hit points to the creature equal to 3d8 + 1 per caster level (maximum +20). If the healing would cause the target to exceed its maximum hit points, the target immediately gains half the excess healing from this spell as temporary hit points that last for 1 hour. These temporary hit points are lost first when the target takes damage (although some temporary hit points are lost even before these temporary hit points, such as the temporary hit points from the shell of succor oracle mystery, described on page 21, or the shell of succor hex granted by the restoration spirit specialization and described on page 27).  This spell also ends any painUM effects, removes all physical ability score damage (from Strength, Dexterity, and Constitution), and removes the following conditions: blinded, dazzled, deafened, nauseated, paralyzed, and sickened.","Healer's Handbook"
