"name","school","subschool","descriptor","spell_level","casting_time","components","costly_components","range","area","effect","targets","duration","dismissible","shapeable","saving_throw","spell_resistance","description","source"
"Mindscape Door","illusion","phantasm","mind-affecting","medium 3, mesmerist 3, psychic 3, sorcerer/wizard 4","1 standard action","V, S","0","close (25 ft. + 5 ft./2 levels)","","one illusory portal","","10 minutes/level","0","0","Will negates (see text)","no","You or other creatures enter into or escape from a mindscape (see page 234) through an imaginary doorway. This doorway takes on any form of your choosing, but can be no larger than a 5-foot cube. This spell has different effects depending on whether you are inside a mindscape when you cast it.  When you cast this spell outside a mindscape, the doorway connects to one mindscape inhabited by a creature of your choice within close range (25 feet + 5 feet per 2 levels) of the door. That creature becomes the door's conduit, but can attempt a Will save to deny access to the mindscape. You must be aware of the mindscape to connect a mindscape door to it. If you connect to the mindscape, you designate any number of creatures to be able to see and pass through the door as though it were a normal doorway. You can name specific creatures or categories of creatures, or allow all creatures access. Creatures other than those you designate can't perceive or use the door, nor can mindless creatures or those immune to mind-affecting effects. Once anyone enters the mindscape through the door, a duplicate of the door appears inside the mindscape next to the creature you used as a conduit. Anyone inside a mindscape is able to perceive and use a mindscape door within that mindscape. Anyone who enters is subject to all rules of the mindscape, but is aware she is in a mindscape if you informed her where the portal leads.  When you cast this spell inside a mindscape, a duplicate of the door appears next to your body in the real world. The creator of the mindscape can attempt a Will saving throw to prevent you  from creating the door if she is within the mindscape. The two doors operate as if you'd cast the spell outside a mindscape. You still designate who can use the door from the real world to get into the mindscape, but you can't prevent creatures within the mindscape from exiting to the real world.  Typically, a mindscape door operates in both directions, but you can create it as a one-way door if you so choose. Unlike with other spells, you can cast this spell as a full-round action while engaged in a psychic duel. This spell can be used to exit a binary mindscape, but not to enter one. If you successfully cast mindscape door within a veiled mindscape, you learn that you are in a mindscape, but other creatures observing the door don't automatically realize they are.","Occult Adventures"
"Mindwipe","enchantment","compulsion","mind-affecting","medium 4, mesmerist 4, occultist 4, psychic 4, sorcerer/wizard 4, spiritualist 4","1 standard action","V","0","close (25 ft. + 5 ft./2 levels)","","","one creature","instantaneous; see text","0","0","Will negates","yes","You erase a portion of the target's mind and experiences, inflicting 2 temporary negative levels on the target for 1 day per caster level. If the target is a spellcaster who must choose and prepare spells in advance, each negative level imposed by mindwipe also causes the target to lose one prepared spell from her highest level of spells known for each of her spellcasting classes for which she must prepare spells. These lost spells are no longer considered known by the target until the corresponding negative levels are removed.  If the target is a spontaneous spellcaster, each negative level inflicted by mindwipe causes her to lose one spell slot of her highest level of spells for each spontaneous spellcasting class in which she has levels and to lose knowledge of one random spell known of that level (or the next lowest level if she has already lost knowledge of all spells known of that level, and so on). The target cannot use the lost spell slots and spells known as long as the corresponding negative levels last. When the target loses a spell known, the spell remains on her class list but she cannot prepare or cast the spell.  If the negative levels from mindwipe cause the target's total number of negative levels to equal or exceed her character level, instead of dying, she enters a catatonic state as long as the negative levels from mindwipe continue to cause her total number of negative levels to equal or exceed her character level.","Occult Adventures"
"Node Of Blasting","abjuration","","mind-affecting","medium 3, mesmerist 3, occultist 2, psychic 3","1 standard action","V","0","touch","","","one touched object weighing no more than 10 lbs.","permanent until discharged (D)","1","0","Will partial; see text","no","You imbue an object with psychic energy. The node of blasting unleashes a mental blast when a creature with a mind touches the object, dealing 6d6 points of damage to the creature touching the object and causing the creature to be staggered for 1 minute. A successful saving throw halves the damage and negates the staggered condition.  Magic traps such as node of blasting are hard to detect and disable. A character with the trapfinding class feature can use Disable Device to thwart node of blasting. The DCs to find a node of blasting using Perception and to disable it using Disable  Device are both equal to 25 + the spell's level. Additionally, a creature with the read aura occult skill unlock (see page 197) can attempt the same Perception check to notice a node of blasting.","Occult Adventures"
"Object Possession","necromancy","","","medium 4, mesmerist 5, occultist 4, psychic 5, sorcerer/wizard 5, spiritualist 5, witch 5","1 standard action","V, S","0","close (25 ft. + 5 ft./2 levels)","","","unattended Large or smaller object (minimum Tiny)","10 minutes/level (D)","1","0","None","No","This spell functions as lesser object possession, except as noted above. The possessed animated object has a number of Construction Points appropriate for its size (up to 3 CP for Large objects).  You can return your consciousness to your body as a standard action. On your next turn, you can attempt to possess a different object as a standard action instead of ending the spell.","Occult Adventures"
"Object Possession, Greater","necromancy","","","occultist 5, psychic 6, sorcerer/wizard 7, spiritualist 6, witch 7","1 standard action","V, S","0","medium (100 ft. + 10 ft./level)","","","unattended Gargantuan or smaller object (minimum Tiny) or construct","10 minutes/level (D)","1","0","None","No","This spell functions as object possession, except as noted above. The possessed animated object has a number of Construction Points appropriate for its size (up to 5 CP for Gargantuan objects). Your silver cord extends to medium range (100 ft. + 10 ft./level).  You can attempt to possess a construct instead of an unattended object as your first possession with this spell. If you do, this spell acts as control constructUM, except as noted above.","Occult Adventures"
"Object Possession, Lesser","necromancy","","","medium 2, mesmerist 3, occultist 2, psychic 3, sorcerer/wizard 4, spiritualist 3, witch 4","1 standard action","V, S","0","touch","","","unattended Tiny or Small object","1 minute/level (D)","1","0","None","No","This spell functions as possession, except you possess an object instead of a creature.  A possessed object becomes capable of animation, gaining the statistics of an animated object of its size (including 1 CP worth of abilities; Pathfinder RPG Bestiary 14). You can't use any spells or other abilities while possessing an object.  A spiritual tether connects your body to the possessed object, in a manner similar to a silver cord (see page 244). If the possessed object and your body are ever farther than close range (25 ft. + 5 ft./2 levels) from one another, this tether breaks, returning your consciousness to your body.","Occult Adventures"
"Object Reading","divination","","","medium 1, mesmerist 2, occultist 1, psychic 2, spiritualist 2","1 standard action","V, S","0","touch","","","one touched object","concentration, up to 1 round per level (D)","1","0","none","no","You read the psychic impressions left upon an object by emotionally or psychically charged events in the item's history, or the information imprinted by the charge object or implant false reading spells. T his spell returns the s ame i nformation a s the psychometry occult skill unlock (see page 196), but gives 1 piece of information when cast and requires 1 round of concentration per additional piece of information instead of 1 minute. You must still attempt an Appraise check to see how much information you gain. You gain a +10 competence bonus on the check.","Occult Adventures"
"Oneiric Horror","illusion","phantasm","mind-affecting","bard 2, medium 1, mesmerist 2, psychic 2, sorcerer/wizard 3","1 standard action","V, S","0","medium (100 ft. + 10 ft./level)","","","one living creature","1 round/level (D)","1","0","Will negates","yes","You cause the subject to believe it is being attacked by a creature out of its nightmares. Each round, the subject makes a full-attack action against the creature. A flying creature can still attempt a Fly check to hover. Each round on its turn after making a full attack against the imaginary creature, the subject can attempt a new saving throw to end the effect. The subject is fatigued for 1 minute after the spell ends.","Occult Adventures"
"Oneiric Horror, Greater","illusion","phantasm","mind-affecting","bard 4, medium 2, mesmerist 3, psychic 4, sorcerer/wizard 5","1 standard action","V, S","0","medium (100 ft. + 10 ft./level)","","","one living creature","1 round/level (D)","1","0","Will negates, Fortitude negates, see text","yes","This spell functions as oneiric horror except each round the subject fails its Will save, it takes 1 point of Strength damage, and after the spell ends, the subject must succeed at a Fortitude save or be fatigued for a number of minutes equal to the number of rounds spent under the spell's effect.","Occult Adventures"
"Paranoia","illusion","phantasm","mind-affecting","bard 2, medium 1, mesmerist 1, psychic 2, sorcerer/wizard 2, witch 2","1 standard action","V, S","0","","","","one creature","1 round/level (D)","1","0","Will negates","yes","The target believes everyone it sees is an enemy. The target becomes hostile to all creatures, treating all creatures as enemies and only itself as an ally. The target must attempt attacks of opportunity whenever any creature provokes them. Finally, whenever the target is adjacent to two or more creatures, its paranoia overwhelms it, and it takes a -2 penalty on attack rolls, weapon damage rolls, ability checks, skill checks, and saving throws.","Occult Adventures"
"Parchment Swarm","transmutation","","","magus 5, occultist 4, sorcerer/wizard 5","1 standard action","S, M (blank parchment or magic scroll; see text)","0","close (25 ft. + 5 ft./2 levels)","","","one creature","instantaneous","0","0","Reflex half; see text","yes","When you cast this spell, you quickly tear a parchment into shreds, releasing the flying fragments to swarm around a target creature and deliver thousands of tiny paper cuts. Using normal parchment, the spell deals 1d6 points of magical slashing damage per caster level (maximum 15d6).  If you use a magic scroll as the material component, choose one of the spells stored in the scroll. If the spell is 1st level, you can choose to apply the effect of that spell to the parchment swarm's target on a failed Reflex save (if the spell on the scroll has its own saving throw, the target then attempts that save as normal). If the spell on the scroll is at least 2nd level, you can choose to instead change parchment swarm to affect a 20-foot-radius spread instead of a single target.","Occult Adventures"
"Placebo Effect","illusion","phantasm","mind-affecting","medium 2, mesmerist 2, psychic 2","1 standard action","V, M (a sugar cube)","0","touch","","","creature touched","1 minute/level","0","0","Will disbelief (harmless)","Yes (harmless)","The subject temporarily ceases to feel the ill effects of a single ongoing affliction or condition from the following list: blinded, cursed, dazed, deafened, diseased, fatigued, frightened, nauseated, panicked, paralyzed, poisoned, shaken, sickened, staggered, or stunned. If that affliction or condition has a duration, it is suspended until this spell expires. If the subject has multiple instances of the same type of affliction (such as multiple diseases), a single casting of this spell can suspend only one of them. Placebo effect doesn't remove or temporarily negate any damage that the affliction may have already caused, nor does it provide protection against receiving such conditions again.","Occult Adventures"
"Possession","necromancy","","","medium 3, mesmerist 5, occultist 4, psychic 5, sorcerer/wizard 5, spiritualist 4, summoner/unchained summoner 5, witch 5","1 standard action","V, S","0","medium (100 ft. + 10 ft./level)","","","one creature","1 hour/level (D)","1","0","Will negates","yes","You attempt to possess a creature by projecting your soul into its  body. The target creature must be within spell range and you must know where it is, though you do not need line of sight or line of effect to it. When you transfer your soul upon casting, your body appears to be dead. Failure to take over a host ends the spell.  If you are successful, your life force occupies the host body. The host's soul is imprisoned with you, but can still use its own senses (though it can't assert any influence or use even purely mental abilities). You can communicate telepathically with the host as if you shared a common language, but only with your consent. You keep your Intelligence, Wisdom, Charisma, level, class, base attack bonus, base save bonuses, alignment, and mental abilities. The body retains its Strength, Dexterity, Constitution, hit points, natural abilities, and automatic abilities. A body with extra limbs doesn't allow you to make more attacks (or more advantageous two-weapon attacks) than normal. You can't activate the body's extraordinary or supernatural abilities, nor can you cast any of its spells or spell-like abilities.  As a standard action, you can shift freely back to your own body regardless of range, so long as it remains on the same plane. If the host's body is killed, you return to your own body and the life force of the host departs (it is dead). If your body is slain, when the spell expires or the host's body is killed, you are slain. It is possible to cast this spell on a new target from within another creature's body; this resets the duration. You still return to your original body (not any intermediate body) when you take a standard action to do so or the spell's duration expires. Returning to your body ends the spell. Creatures whose souls are their bodies, such as incorporeal undead and non-native outsiders, use the effects of greater possession instead.","Occult Adventures"
"Possession, Greater","necromancy","","","occultist 6, psychic 8, sorcerer/wizard 8, spiritualist 6, witch 8","1 standard action","V, S","0","medium (100 ft. + 10 ft./level)","","","one creature","1 hour/level (D)","1","0","Will negates","yes","This spell functions as possession, but when you possess a host, you enter the host's body and your physical body vanishes. You are ejected to the closest empty square upon expiration of the spell or upon the host's death.","Occult Adventures"
"Primal Regression","enchantment","compulsion","mind-affecting","druid 6, mesmerist 5, psychic 6, shaman 6, witch 7","1 standard action","S","0","close (25 ft. + 5 ft./2 levels)","","","one creature/2 levels, no two of which can be more than 30 feet apart","1 minute/level","0","0","Will negates","yes","This spell sequesters the targets' ability for higher reasoning, allowing their darker impulses to come to the fore. An affected target becomes a ravening monster-savage, bloodthirsty, and brutish. Until the spell ends, the targets have all of the following benefits and drawbacks.  • Targets' Intelligence and Charisma scores drop to 3 (if the scores were higher), and they are unable to use Intelligence-or Charisma-based skills, cast spells, understand language, or communicate coherently.  • Targets take a -4 penalty on Will saves.  • Targets gain a +6 enhancement bonus to Strength, a +2 natural armor bonus to AC, and 2d8 temporary hit points. These temporary hit points disappear at the end of the spell's duration.  When the spell ends, each affected creature must succeed at a Will saving throw or take 1d4 points of Intelligence drain and 1d4 points of Charisma damage.","Occult Adventures"
"Psychic Asylum","illusion","phantasm","mind-affecting","mesmerist 5, psychic 5, sorcerer/wizard 6","1 swift action","V, S","0","personal","","","you","instantaneous; see text","0","0","none","no","You retreat into a mindscape (see page 234) of your own making that allows you to perform a lengthy mental task in an instant. You create a mental landscape that provides succor and calm for you, such as a library, sitting room, garden, or childhood tree house. You can spend up to 15 minutes in your psychic asylum. While you are within, no time passes for your body, and when you emerge you can continue with your turn. The mindscape is overt, finite, and has a rapid passage of time.  While within the mindscape, you can consult any text, recall any conversation, or remember any image that you have been exposed to with perfect clarity and recollection, as if you had an eidetic memory. You must have seen or heard the material within a time frame of 1 week per level. For example, you might wish to reexamine a passage of text from an ancient manuscript you rapidly scanned in a library 2 weeks prior. While in the psychic asylum, you can perfectly recall the precise layout of the text  within the ancient manuscript and read it word for word. Once you emerge from the psychic asylum, you can recall the details of what you had just studied as clearly as if you had just looked at it, but you no longer have total recall of the material.  If you're able to prepare spells, you can use the time to prepare a single spell. For example, if you were poisoned, you could use your swift action to cast psychic asylum, pray and meditate for the full 15 minutes to gain neutralize poison, then emerge from the mindscape and immediately cast the spell upon yourself as your standard action.  Any mind-affecting spell that was affecting you before you cast the spell continues to expend its duration on you while you are within the psychic asylum, so you can use this spell to wait out the effects of such a condition. Effects that are currently affecting your body do not expend additional duration while you are in the psychic asylum, but you also don't experience their effects during the time spent there.","Occult Adventures"
"Psychic Crush I","necromancy","","mind-affecting","psychic 5","1 standard action","S","0","close (25 ft. + 5 ft./2 levels)","","","one creature","instantaneous","0","0","Will partial and Fortitude partial; see text","yes","Using your psychic power, you invade the mind of the target and tear it asunder, causing massive internal damage to both its mind and body. If the target succeeds at the initial Will save, it is sickened for 1 round. If the target fails its Will save, it must attempt a Fortitude save (with a +4 circumstance bonus on this save if it has more than half its total hit points remaining). If it also fails the Fortitude save, the target is reduced to -1 hit points and is dying. If the target succeeds at its Fortitude save, it instead takes 3d6 points of damage + 1 point of damage per caster level, which cannot reduce the target below -1 hit point, and the target is sickened for 1 round. This attack has no effect on creatures without an Intelligence score.","Occult Adventures"
"Psychic Crush II","necromancy","","mind-affecting","psychic 6","1 standard action","S","0","close (25 ft. + 5 ft./2 levels)","","","one creature","instantaneous","0","0","Will partial and Fortitude partial; see text","yes","This functions as psychic crush I, but on a successful Fortitude save, the target takes 5d6 points of damage + 1 point of  damage per caster level. In addition, the target receives a +4 circumstance bonus on the Fortitude save only if it is at full hit points; otherwise, it gains a +2 bonus if it has more than half its total hit points remaining. This spell can be undercast.","Occult Adventures"
"Psychic Crush III","necromancy","","mind-affecting","psychic 7","1 standard action","S","0","close (25 ft. + 5 ft./2 levels)","","","one creature","instantaneous","0","0","Will partial and Fortitude partial; see text","yes","This functions as psychic crush I, but the target takes 7d6 points of damage + 1 point of damage per caster level on a successful Fortitude save and 1 point of damage per caster level on a successful Will save. The target receives a +2 circumstance bonus on the Fortitude save if it is at full hit points, and no bonus if it has taken any damage. This spell can be undercast.","Occult Adventures"
"Psychic Crush IV","necromancy","","mind-affecting","psychic 8","1 standard action","S","0","close (25 ft. + 5 ft./2 levels)","","","one creature","instantaneous","0","0","Will partial and Fortitude partial; see text","yes","This functions as psychic crush I, but the target takes 9d6 points of damage + 1 point of damage per caster level on a successful Fortitude or Will save. The target does not receive any saving throw bonus because of its hit points. If it is at fewer than half its total hit points, it doesn't gain a Fortitude save to resist this spell but instead proceeds as if it had automatically failed its Fortitude save. This spell can be undercast.","Occult Adventures"
"Psychic Crush V","necromancy","","mind-affecting","psychic 9","1 standard action","S","0","close (25 ft. + 5 ft./2 levels)","","","one creature","instantaneous","0","0","Will partial and Fortitude partial; see text","yes","This functions as psychic crush IV, but on a successful Fortitude or Will save, the target takes 11d6 points of damage + 1 point of damage per caster level. If it is at fewer than half its total hit points, the target takes a -2 penalty on the Will save to resist this spell. This spell can be undercast.","Occult Adventures"
"Psychic Image","illusion","shadow","","psychic 9","1 standard action","V","0","long (400 ft. + 40 ft./level)","","one shadow duplicate","","1 round/level (D)","1","0","Will disbelief (if interacted with)","yes","You envelop your consciousness in a quasi-real image of yourself. Your psychic image looks, sounds, and smells like you, but is intangible. While your mind occupies the image, you control it as though it were your own body, but you cannot directly affect physical objects. Your image moves with a fly speed of 60 feet and perfect maneuverability. Your senses perceive only what the image can see and hear while occupying it, and your own body is considered blind, deaf, and helpless. You can switch between the image and your body as a swift action. While your mind is in your body, the image is similarly helpless.  Your image can pass through solid objects as though you are incorporeal. It cannot go farther into a solid object than  your space (5 feet for a Small or Medium creature). It can't be damaged by most attacks or effects, whether or not they affect incorporeal creatures. However, mind-affecting effects targeted against or affecting your psychic image have their full effect on you whenever your mind occupies it.  If you desire, you can cast any psychic spell or spell-like ability with a range of touch or greater while your mind occupies your image. You can't cast non-psychic spells through the image, even if you possess them. The psychic image can cast only psychic illusion spells on itself. The spells affect other targets normally, despite originating from the psychic image.  Objects are affected by the psychic image as if they had succeeded at their Will saves. You need not maintain line of effect to your psychic image, but if you cross into another plane even for an instant, such as via blink, dimension door, or similar spells, the spell ends.","Occult Adventures"
