"name","school","subschool","descriptor","spell_level","casting_time","components","costly_components","range","area","effect","targets","duration","dismissible","shapeable","saving_throw","spell_resistance","description","source"
"Psychic Reading","divination","","","bard 2, inquisitor 2, medium 1, mesmerist 1, occultist 1, psychic 1, sorcerer/wizard 2, spiritualist 1","1 standard action","V","0","close (25 ft. + 5 ft./2 levels)","","","one humanoid creature","1 round","0","0","none","yes","You are able to read a person's surface thoughts and take cues from the person's appearance, body language, and manner of speech to infer a great deal of information about the person, even if that person is in disguise (including polymorph effects). When casting the spell, attempt a DC 20 Sense Motive check with a bonus equal to your caster level. A successful skill check reveals to you one of the following pieces of information of your choice, plus one additional piece of information for every 5 points by which your check result exceeds 20: age, alignment, class&#8224;, feats&#8224;, gender, native language, place of origin, race or ethnicity, racial traits&#8224;, religion, sexual orientation, or training in a Craft, Perform, or Profession skill. For items marked with a cross (&#8224;), if the target has more than one of these features, each one you discover counts as a piece of information.  There's a 70% chance that all information you receive is correct. This roll is made secretly. Otherwise, on a roll of 71-80, you receive one false piece of information, on a roll of 81-90 you receive two, and on a roll of 91-100 you receive three. You can't get more false information than the total number of pieces of information you discover.","Occult Adventures"
"Psychic Surgery","enchantment","","mind-affecting","mesmerist 5, psychic 6","10 minutes","V, M (diamond dust worth 250 gp)","1","touch","","","one willing and living creature","instantaneous","0","0","none","no","Psychic surgery cures the target of all Intelligence, Wisdom, and Charisma damage and restores all points permanently drained from the target's Intelligence, Wisdom, and Charisma scores. It also eliminates all ongoing insanity, confusion, and fear effects. Psychic surgery can also remove other mental afflictions, including enchantment spells and abilities, and even instantaneous effects, but in this case, if dispel magic couldn't remove the effect, psychic surgery works only if the spell level or equivalent spell level of the effect was 6th level or lower. Psychic surgery removes all effects magically altering the target's memory, even instantaneous effects, and it can restore a memory to perfect clarity like the second use of modify memory.","Occult Adventures"
"Purge Spirit","necromancy","","","medium 2, occultist 2, psychic 3, sorcerer/wizard 4, spiritualist 2, witch 4","1 standard action","V, S","0","medium (100 ft. + 10 ft./level)","","","one creature or haunt","instantaneous","0","0","Will partial","yes","Purge spirit rips away at the target's spiritual substance, scattering it over a wide area and hampering the target's ability to reform. The target takes 1d6 points of damage per caster level (maximum 10d6) and is staggered for 1 round. On a successful saving throw, the target takes half damage and is not staggered. This spell affects astrally projected creatures, ethereal creatures, haunts, incorporeal creatures, mediums channeling a spirit, and phantoms, and at the GM's discretion can affect other spirits or creatures made of ectoplasm. Incorporeal creatures take full damage from purge spirit.","Occult Adventures"
"Quintessence","illusion","glamer","","bard 1, medium 1, mesmerist 1, occultist 1, psychic 1, sorcerer/wizard 1","1 standard action","V, S","0","touch","","","creature or object touched","10 minutes/level (D)","1","0","Will negates (harmless) and Will disbelief; see text","see text","You draw forth the idealized image of the target creature or object, masking any flaws or damage. An injured or ill creature appears healthy, and a damaged object or one with the broken condition appears intact. However, a corpse  masked by quintessence remains obviously dead, and a completely destroyed object can't be made to seem whole. This illusion has visual and tactile components. Careful examination of or handling the target grants a saving throw to disbelieve, but casual observation does not. Using a broken object for its intended purpose automatically reveals the deception. Appraise checks to assess the value of an object affected by quintessence estimate the value as an item of its type in perfect condition, unless the appraiser disbelieves the illusion.  Unwilling targets can negate the spell's effect on them with successful Will saves or with spell resistance. Those who interact with the target can attempt Will saves to see through the glamer, but spell resistance doesn't apply. Quintessence counters and dispels decrepit disguise.","Occult Adventures"
"Remote Viewing","divination","scrying","","medium 4, occultist 5, psychic 5, spiritualist 5","1 hour","V, S, M (incense)","0","see text","","","you","instantaneous","0","0","","","Your body enters a trance as you send your psychic senses to a distant location and gain psychic impressions of that location. You must specify the distance and direction to the location you desire to view remotely. This spell doesn't allow you to see the visual appearance of the location's surface, so it isn't useful for casting spells like teleport, but it grants you a psychic impression of the location, which could give you deeper information. For example, a forest that is home to a tight-knit community of fey might appear as a city in the trees, or a beautiful palace ruled by an evil king and warded by forbiddance might appear as a dark fortress encased in insubstantial chains.  During the 1 hour casting time of remote viewing, your real body is unconscious and helpless, and you are unaware of its surroundings.","Occult Adventures"
"Repress Memory","enchantment","compulsion","mind-affecting","bard 5, mesmerist 5, psychic 6","1 round","V, S","0","personal","","","you","instantaneous","0","0","","","This spell allows you to safeguard important knowledge, even from yourself. When casting this spell, you recount one piece of knowledge you possess (up to a maximum of 50 words). This knowledge disappears utterly from your mind, and you might not realize you forgot something. The magic of the spell patches omissions in your memory with indistinct haze  Repress memory protects against detect thoughts, discern lies, zone of truth, and similar spells, though careful questioning may reveal the gaps in your memory, or that your memory has been affected by the spell.  A repressed memory can be restored only by break enchantment, psychic surgery, limited wish, miracle, or wish. If you use this spell to negate the memory of a magical compulsion, it doesn't remove the compulsion, nor does it remove procedural memories that might affect your skills or class abilities.  At the GM's discretion, multiple castings of this spell might erase memories of a lengthier event or all memory of a place or individual from your memory.","Occult Adventures"
"Retrocognition","divination","","","medium 3, occultist 3, psychic 5, sorcerer/wizard 7","1 minute","V, S","0","personal","","","you","concentration, up to 1 minute/level","0","0","","","This spell allows you to gain psychic impressions from past events that occurred in your current location. Retrocognition reveals psychic impressions from events that occurred over the course of the last hour throughout the first minute of the duration, followed by impressions from the next hour back the next minute you concentrate, and so on. If a psychically traumatic or turbulent event happened during that time period, you must succeed at a concentration check (DC = 20, 30, or 40, depending on the severity of the psychic disturbance) or lose concentration on the spell.  At caster level 13th and higher, you can choose to collect impressions from over the course of a longer interval of time than an hour, beginning at 1 week per minute of concentration (as listed on the table below). The amount of detail you receive diminishes, so this eventually makes it harder to distinguish impressions left by anything but the most major events.  Caster Level Time Period  13th-15th 1 week per minute  16th-18th 1 year per minute  19th+ 1 century per minute","Occult Adventures"
"Riding Possession","necromancy","","","medium 2, mesmerist 4, occultist 3, psychic 4, sorcerer/wizard 4, spiritualist 3, summoner/unchained summoner 4, witch 4","1 standard action","V, S","0","medium (100 ft. + 10 ft./level)","","","one creature","1 hour/level (D); see text","1","0","Will negates","yes","You stealthily project your soul into the host's body as an observer, with limited ability to influence the target. This functions as possession, except the host is still in full control of its body and is unaware you are possessing it. You can't communicate with the host directly, but you can cast mind-affecting spells or riding possession on the host as long as you can cast these spells as purely mental actions. Even if the spell you cast would normally affect more than one target or an area, it can affect only the host. If the host succeeds at a saving throw against a spell that you cast in this way, it immediately becomes aware that it is possessed, and if it was already aware, it receives another saving throw against riding possession. Protection from evil and similar effects don't expel you from the host, but they do prevent you from casting further spells from within your host until their durations expire.","Occult Adventures"
"Sealed Life","abjuration","","","medium 2, spiritualist 3","1 standard action","S","0","close (25 ft. +5 ft./2 levels)","","","one creature","1 round/level","0","0","none","yes","You seal the life force within the target, preventing it from sharing its vitality with others. Affected creatures can't transfer damage to or from another, such as through shield other, a spiritualist's life bond, or a summoner's life link. Effects such as vampiric touch that steal vitality from others deal damage normally, but provide no benefits.","Occult Adventures"
"Sealed Life, Greater","abjuration","","","spiritualist 6","1 standard action","S","0","close (25 ft. +5 ft./2 levels)","","","one creature","1 minute/level","0","0","none","yes","This spell functions as sealed life, except it additionally provides the benefits of death ward and renders its targets immune to effects that extract or transfer its soul, such as possession and trap the soul. This spell prevents a soul from returning to its body if it has already departed, until the spell's duration expires.","Occult Adventures"
"Sessile Spirit","necromancy","","","cleric/oracle 5, inquisitor 4, medium 2, occultist 3, shaman 4, spiritualist 3, witch 5","1 standard action","V, S","0","medium (100 ft. + 10 ft./level)","","","one creature or object (see text)","1 round/level (D)","1","0","Will negates (harmless)","yes","You reach into the target creature and cause that spirits within to become dormant and inactive. If the target is a medium with a spirit inhabiting its body or a spiritualist with a phantom inhabiting its consciousness (or a member of another class using the spirit or phantom class features), a failed save renders that spirit or phantom powerless, suppressing any benefits the spirit or phantom normally provides to its host, including bonus feats and spells known.  If a spirit within the target is a creature using a possession effect, including possess object, possession, or a ghost's malevolence, the spell targets the possessing creature rather than the creature it inhabits. On a failed save, the possessing spirit isn't exorcised from the target but is dazed for the duration of the spell.","Occult Adventures"
"Shadow Body","transmutation","polymorph","","sorcerer/wizard 7, spiritualist 5, witch 7","1 standard action","V, S","0","personal","","","you","1 minute/level (D)","1","0","","","You exchange the crude matter of your material body with the insubstantial essence of the Plane of Shadow, becoming a living shadow yourself. You are visible as an unattached shadow in bright light or normal light, but you gain total concealment in dim light or darkness. Against creatures with darkvision, you gain concealment rather than total concealment. Your shadow body is incorporeal for most purposes, though you can't fly or pass through solid objects or creatures. However, you can move at your normal speed along any surface, including horizontal and vertical surfaces and liquids, and you are never slowed by difficult terrain. Your size doesn't change.  You can speak and cast spells and perform mental actions, but you have no physical substance and cannot manipulate objects or attack physically. You can deliver touch spells and effects as if making an incorporeal touch attack. Your equipment merges with your shadow body, so you can't cast spells with a material component unless those spells are prepared with Eschew Materials.","Occult Adventures"
"Spirit-Bound Blade","evocation","","","medium 4, occultist 4, shaman 4, spiritualist 3","1 standard action","S","0","touch","","","weapon touched","1 minute/level","0","0","Will negates (harmless, object)","no","You focus emotional energy and weave it into a shroud of hardened ectoplasm around the weapon you touch, infusing it with a ghostly glow and great power. The weapon becomes a ghost touch weapon, and gains one of the following additional benefits, depending on the type of emotion you  infuse into the weapon. If a special ability wouldn't apply to the chosen weapon (such as vicious on a ranged weapon), the weapon doesn't gain that benefit.  Anger: The weapon also gains the vicious special ability.  Dedication: The weapon also gains the returning special ability.  Despair: The weapon also gains the cruelUE special ability.  Fear: The weapon also gains the menacingUE special ability.  Hatred: The weapon also gains the cunningUE special ability.  Jealousy: The weapon also gains the mimeticUE special ability.  Zeal: The weapon also gains the keen special ability.  If you are a spiritualist and the type of emotional energy you choose matches the emotional focus of your phantom, the weapon grants its wielder a +2 bonus on skill checks with both skills you gain Skill Focus in from your phantom's emotional focus.","Occult Adventures"
"Synapse Overload","divination","","mind-affecting","mesmerist 4, psychic 5","1 standard action","V","0","touch","","","living creature touched","instantaneous","0","0","Fortitude partial (see text)","yes","You cause the target's mind to unleash a vast overflowing torrent of information throughout the target's body, causing the target's synapses to violently trigger. The target takes 1d6 points of electrical damage per caster level (maximum 15d6) and is staggered for 1 minute. A successful Fortitude saving throw doesn't reduce the damage, but it negates the staggered effect.","Occult Adventures"
"Synaptic Pulse","enchantment","compulsion","mind-affecting","mesmerist 3, psychic 3","1 standard action","V","0","30 ft.","30-ft.-radius spread centered on you","","","1 round","0","0","Will negates","yes","You emit a pulsating mental blast that stuns all creatures in range of your psychic shriek for 1 round.","Occult Adventures"
"Synaptic Pulse, Greater","enchantment","compulsion","mind-affecting","mesmerist 4, psychic 5","1 standard action","V","0","30 ft.","30-ft.-radius spread centered on you","","","1d4 rounds; see text","0","0","Will negates","yes","You emit a pulsating mental blast that stuns all creatures in range of your psychic shriek for 1d4 rounds. On a successful save, a creature is instead sickened for 1 round.","Occult Adventures"
"Synaptic Scramble","enchantment","compulsion","mind-affecting","mesmerist 3, psychic 4","1 standard action","V, S","0","medium (100 ft. + 10 ft./level)","","","one creature","1 round/level","0","0","Will negates","yes","You scramble the synaptic connections of your target, causing it to lose the ability to coherently communicate and to take unintended actions when it meant to perform others. The target cannot effectively communicate while under the spell's influence, and thus cannot engage in acts like speaking, attempting Bluff checks to pass secret messages, writing, or using telepathy, although the spell doesn't prevent verbalizations made for purposes other than communication, such as command words or the verbal component of spellcasting.  The target's mind is too scrambled to take full-round actions or longer actions, as the target's attention inevitably wanders before the action completes. Whenever the target attempts to take a move action or a standard action, roll on the following table instead. If the result on the table is an action that the target cannot take, the target takes no action instead.  d% Action  1-20 Move action (must use move action to move)  21-40 Other move action (perform a move action other than moving)  41-60 Attack action (spend a standard action on the attack action, attacking once with a weapon)  61-80 Other standard action (perform a standard action that isn't the attack action)  81-100 Desired action (perform whatever standard or move action the creature desires to perform)","Occult Adventures"
"Synesthesia","illusion","phantasm","mind-affecting","mesmerist 3, psychic 3","1 standard action","V, S","0","close (25 ft. + 5 ft./2 levels)","","","one living creature","1 round/level","0","0","Will negates","yes","You overstimulate the senses of the affected creature, causing its senses to interfere with another. While a creature is under the effects of this spell, sensory input is processed by the wrong  senses, such that noise triggers bursts of colors, smells create sounds, and so on. The affected creature moves at half speed, has a 20% miss chance on attacks, and takes a -4 penalty to AC and on skill checks and Reflex saves. Successful spellcasting while affected requires a concentration check with a DC equal to this spell's save DC plus the level of spell being cast.  In addition, the affected creature is considered distracted for the purpose of attempting Perception checks. Effects that negate or reduce concealment do not affect the miss chance from synesthesia.","Occult Adventures"
"Synesthesia, Mass","illusion","phantasm","mind-affecting","mesmerist 5, psychic 7","1 standard action","V, S","0","medium (100 ft. + 10 ft./level)","","","one or more living creatures, no two of which can be more than 30 ft. apart","1 round/level","0","0","Will negates","yes","This spell functions like synesthesia, except as noted above.","Occult Adventures"
"Talismanic Implement","evocation","","","occultist 3","10 minutes","V","0","personal","","","you","1 hour/level (D) or until discharged","1","0","","","This spell functions as contingency, but you invest a spell whose level doesn't exceed one-quarter of your level (rounded down, maximum spell level 3rd) into one of your implements that holds 2 or more points of mental focus. The spell's school must match that of the implement, and the spell must be one that affects only your person. Casting talismanic implement reduces the selected implement's mental focus by 2, including for the purposes of determining the effects of resonant powers. When you refresh your mental focus, talismanic implement ends automatically, even if the duration hasn't elapsed. Unlike contingency, you may have multiple talismanic implements simultaneously, though a single implement can hold only one talismanic implement spell, and if you have any talismanic implements, you can't have any other kind of contingency in effect.","Occult Adventures"
"Telekinetic Maneuver","transmutation","","","magus 4, psychic 3, sorcerer/wizard 4, spiritualist 4","1 standard action","V, S","0","close (25 ft. + 5 ft./2 levels)","","","one creature","concentration (up to 1 round/level)","0","0","none","yes","This spell functions as telekinesis, but it can be used only to perform a bull rush, disarm, drag, grapple (including pin), reposition, steal, or trip combat maneuver.","Occult Adventures"
"Telekinetic Projectile","evocation","","","occultist 0, psychic 0, spiritualist 0","1 standard action","V, S","0","close (25 ft. + 5 ft./2 levels)","","","","instantaneous","0","0","no","no","You fling an object weighing up to 5 pounds at the target. You must succeed at a ranged attack (not a ranged touch attack) to hit your target; if you hit, you deal 1d6 points of bludgeoning damage to both the target and the object. The type of object thrown doesn't change the damage type or any other properties of the attack, even if you throw a weapon or magic item in this way.","Occult Adventures"
"Telekinetic Storm","evocation","","force","psychic 9","1 standard action","V, S","0","","40-ft.-radius burst centered on you","","","instantaneous","0","0","Fortitude partial (see text)","yes","You generate a storm of telekinetic energy that emanates from you, ripping through the spell's area of effect with devastating force. Any creature caught in the spell's radius takes 1d6 points of damage per caster level (maximum 20d6) and is dazed and stunned for 1 round. A successful Fortitude save reduces the damage by half and negates the dazed and stunned effects.  The telekinetic storm damages objects in the area. If the damage caused to an interposing barrier shatters or breaks through it, the telekinetic storm continues beyond the barrier if the spell's area permits; otherwise, it stops at the barrier just as any other spell effect does.  You can designate any number of creatures to be immune to the spell's effect, though you must be capable of targeting those creatures.","Occult Adventures"
"Telempathic Projection","enchantment","compulsion","emotion, mind-affecting","mesmerist 1, psychic 1, spiritualist 1","1 standard action","V, S","0","medium (100 ft. + 10 ft./level)","","","one creature","1 minute/level","0","0","Will negates (see text)","yes","You alter the target's mood, adjusting its attitude toward you or another creature you designate by one step either positively or negatively (see the Diplomacy skill on page 94 of the Pathfinder RPG Core Rulebook). You can instead use this spell to assist your own or an ally's Bluff, Diplomacy, Intimidate, Perform, or Sense Motive check, granting that check a +5 insight bonus against the target of your telempathic projection with no save. In this case, the spell's duration expires immediately when the skill check is complete.","Occult Adventures"
"Telepathy","divination","","mind-affecting","medium 4, mesmerist 4, psychic 5, sorcerer/wizard 6, spiritualist 6","1 standard action","V","0","personal","","","you","1 minute/level","0","0","","","You can mentally communicate with any other creature within 100 feet that has a language. It is possible to address multiple creatures at once telepathically, although maintaining a telepathic conversation with more than one creature at a time is just as difficult as speaking and listening to multiple people simultaneously.","Occult Adventures"
"Thaumaturgic Circle","abjuration","","","cleric/oracle 4, inquisitor 4, medium 3, occultist 3, sorcerer/wizard 4, summoner/unchained summoner 4","1 standard action","V, S, M (a 3-ft.-diameter circle of powdered silver), DF","0","touch","10-ft.-radius emanation from touched creature","","","10 min./level","0","0","Will negates (harmless)","no; see text","This spell functions as magic circle against chaos, evil, good, or law, but rather than stipulating an alignment descriptor, you can designate any one non-alignment subtype of outsider, including air, earth, fire, and water, as well as outsider races such as angels and devils.","Occult Adventures"
"Thought Echo","illusion","glamer","","mesmerist 1, psychic 1","1 round","V","0","touch","","","living creature touched","1 minute/level (D)","1","0","Will negates (harmless)","yes (harmless)","When you cast this spell, you establish a mental echo of up to 25 words. Any attempt to read the surface thoughts of the target creature reads only this mental echo unless the caster succeeds at a caster level check (DC = 11 + your caster level). If you cast thought echo on yourself, the DC is instead equal to 15 + your caster level. In addition, when casting this spell upon yourself, you can change the echoed thoughts by taking a standard action and concentrating.  Each time you change the words echoed by the spell in this way, you reduce the spell's remaining duration by 1 minute. Thought echo d oes n ot i nterfere w ith t elepathy o r m ind reading effects that are capable of reaching thoughts deeper than surface thoughts.","Occult Adventures"
"Thought Shield I","abjuration","","","psychic 2","1 immediate action","V","0","personal","","","you","1 round","0","0","","","Sensing an intrusion, you throw up a defense to protect your mind from attack or analysis. This grants you a +4 circumstance bonus on Will saving throws against mind-affecting effects. As long as this spell lasts, spells and effects that allow a creature to read your thoughts receive no information from you.","Occult Adventures"
"Thought Shield II","abjuration","","","psychic 3","1 immediate action","V","0","personal","","","you","1 round","0","0","","","This functions as thought shield I, but the circumstance bonus on Will saves to resist mind-affecting effects increases to +6. This spell can be undercast.","Occult Adventures"
