"name","school","subschool","descriptor","spell_level","casting_time","components","costly_components","range","area","effect","targets","duration","dismissible","shapeable","saving_throw","spell_resistance","description","source"
"Naga Shape II","transmutation","polymorph","","alchemist 5, bloodrager 5, magus 5, sorcerer/wizard 5","1 standard action","V, S, M (a piece of the creature whose form you want to assume)","0","personal","","","you","1 minute/level (D)","1","0","","","This spell functions as naga shape I. Additionally, if the form you assume has any of the following abilities, you gain the listed ability: burrow 30 feet, climb 90 feet, fly 90 feet (good maneuverability), swim 90 feet, blindsense 30 feet, darkvision 60 feet, low-light vision, compression, constrict, detect thoughts, dreamsight, grab, hypnosis, poison, sneak attack +2d6, and spit.","Blood Of The Beast"
"Naga Shape III","transmutation","polymorph","","alchemist 6, bloodrager 6, magus 6, sorcerer/wizard 6","1 standard action","V, S, M (a piece of the creature whose form you want to assume)","0","personal","","","you","1 minute/level (D)","1","0","","","This spell functions as naga shape I. Additionally, if the form you assume has any of the following abilities, you gain the listed ability: burrow 60 feet, climb 90 feet, fly 120 feet (good maneuverability), swim 120 feet, blindsense 60 feet, darkvision 90 feet, low-light vision, tremorsense 60 feet, bleed, compression, constrict, detect thoughts, dreamsight, grab, hypnosis, poison, sneak attack +3d6, and spit.","Blood Of The Beast"
"Depilate","necromancy","","","bard 1, druid 1, sorcerer/wizard 1, witch 1","1 round","S, M (a sliver of cow's tongue)","0","medium (100 ft. + 10 ft./level)","","","one creature with hair or fur","instantaneous","0","0","Will negates","yes","This simple jinx causes a target's hair or fur to fall out in patchy clumps, leaving the creature disheveled and less commanding. A jinxed creature takes a -2 penalty on all Diplomacy, Intimidate, and Perform checks until the hair begins to regrow 1 week later, or until the damage can be concealed with a successful Disguise or Heal check (the DC is equal to the original save DC of the spell). A successful break enchantment, remove curse, or similar effect instantly regrows the target's hair or fur and removes the spell's effects.","Blood Of The Beast"
"Fumblestep","conjuration","","","mesmerist 1, sorcerer/wizard 1, spiritualist 1, witch 1","1 standard action","V, S, M (a sharp pebble)","0","close (25 ft. + 5 ft./2 levels)","","","one creature","1 minute/level or until discharged (see text)","0","0","none (see text)","yes","Fumblestep coats a target's feet in slick ectoplasm that retains some psychic connection to your mind. While the spell remains in effect, the target creature takes a -1 penalty on Reflex saving throws and Acrobatics checks.  At any point during the spell's duration while the target remains in range, you can discharge the spell as a standard action, mentally tugging at the ectoplasm to perform a trip combat maneuver, using your caster level instead of your base attack bonus, and using your Charisma, Intelligence, or Wisdom modifier, whichever is highest, instead of your Strength modifier. This trip attempt does not provoke an attack of opportunity and cannot be affected by feats or other means of altering a trip combat maneuver's effects.","Blood Of The Beast"
"Lightfingers","transmutation","","","psychic 1, spiritualist 1, witch 1","1 standard action","V, S","0","close (25 ft. + 5 ft./2 levels)","","","one creature","instantaneous","0","0","none","yes","A flutter of subtle, telekinetic force causes your target to drop a single nonmagical carried item weighing no more than 1 pound per caster level, such as a coin purse, a key ring, or a loose object in its pocket. The target must succeed at a Perception check against the spell's save DC to notice the dropped item. You select what item the target drops as long as you can see both your target and the item you wish to affect. This use of the spell can't cause a target to lose a held item or anything it is wearing, including jewelry.  You can instead cast lightfingers to attempt a single disarm or stealAPG combat maneuver, using your caster level instead of your base attack bonus, and using your Charisma, Intelligence, or Wisdom modifier, whichever is highest, instead of your Strength modifier. This disarm or steal attempt does not provoke attacks of opportunity and cannot be affected by feats or other means of altering a combat maneuver's effects. This use of the spell is immediately obvious.","Blood Of The Beast"
"Amnesia","enchantment","compulsion","mind-affecting","bard 4, medium 3, mesmerist 4, psychic 4, sorcerer/wizard 4","1 round","V, S","0","close (25 ft. + 5 ft./2 levels)","","","one living creature","instantaneous","0","0","Will negates","yes","You cause the target to lose most of its memories; its skills, its past, and even its name become mysteries to it. While the target can build new memories, it has trouble accessing those gained before falling victim to the spell. The target can still speak and read any languages it knows and perform basic tasks, but it loses all class abilities, feats, and skill ranks gained before being affected by amnesia. It retains its base attack bonus, saving throws bonuses, Combat Maneuver Bonus, Combat Maneuver Defense, total experience points, Hit Dice, and hit points. If the target gains a character level while suffering from amnesia, it can use any abilities gained by that class level normally. If the class level it gained was from a class in which it already has levels, it gains the abilities of a 1st-level character of that class, even though it is technically of a higher level in that class. If the amnesia is cured, the target regains the full abilities of the class, including those gained from any levels taken while suffering from this condition. Amnesia can be removed only by heal, limited wish, miracle, psychic surgeryOA, or wish.","Villain Codex"
"Appearance Of Life, Greater","illusion","glamer","","cleric/oracle 5, medium 4, mesmerist 5, psychic 5, sorcerer/wizard 5, spiritualist 4, witch 5","1 round","V, S, M (one Tiny or larger living creature)","0","touch","","","one willing undead creature touched","1 hour/level","0","0","Will disbelief or Will negates (see text)","no","This spell functions as appearance of life (Pathfinder RPG Horror Adventures 108), except that you can disguise a single undead creature regardless of its number of Hit Dice, and the illusion also creates relevant smells, sounds, textures, and temperatures  to match the appearance. If you disguise the target as a living version of itself, creatures that interact with the target take a -5 penalty on their Will saving throws to disbelieve the illusion, though if the target attacks a creature, the attacked creature no longer takes this penalty.","Villain Codex"
"Covetous Urge","enchantment","compulsion","curse, language-dependent, mind-affecting","bard 2, sorcerer/wizard 2, summoner/unchained summoner 2, witch 2","1 standard action","V, S, M (a golden coin)","0","close (25 ft. + 5 ft./2 levels)","","","one living creature with 7 HD or fewer","1 minute/level (D)","1","0","Will negates","yes","You curse the target with insatiable greed, causing it to attempt to steal any item worth 100 gp or more that it can see, each time it enters a new room or area. If it can see multiple items of value in a single room or area, it attempts to steal the item it thinks is worth the most. This covetous compulsion might cause the target to act recklessly where it normally would not (unless acting in this manner would clearly cause it to die, suffer great harm, or get caught).  In combat, if the target sees a valuable item on an opponent, it must, for example, attempt to disarm its foe to take a valuable weapon or use the steal combat maneuver (Pathfinder RPG Advanced Player's Guide 322) to grab a precious item kept on the opponent's belt. Once the target has either attempted to steal an item in combat or else taken damage, this magical compulsion subsides until the threat of the current combat ends and the target enters a new room or area. Affected targets in combat that have neither attempted to steal an item nor taken damage (perhaps because the opponent with the most valuable item is far away) can attempt a saving throw each round to ignore the spell's effect until the threat ends and the target enters a new room.  Break enchantment, limited wish, miracle, remove curse, or wish can each end covetous urge before the duration expires. Dispel magic does not affect covetous urge.","Villain Codex"
"Hide Bruises","illusion","glamer","","antipaladin 1, bard 1, inquisitor 1, mesmerist 1, occultist 1, psychic 1, sorcerer/wizard 1, witch 1","1 standard action","V, S, M (drop of blood)","0","touch","","","one creature touched","10 minutes/level (D)","1","0","none and Will disbelief (see text)","yes (harmless)","The target's wounds to seem to disappear. A creature attempting a Heal check to tell the severity of the target's injuries takes a -10 penalty on that check. A creature that physically touches the glamered areas can attempt a Will save to recognize it as an illusion.","Villain Codex"
"Resist Starvation","transmutation","","","antipaladin 1, cleric/oracle 1, shaman 1","1 standard action","V, S, M (crumb of food)","0","touch","","","one living creature touched","1 day/level","0","0","Will negates (harmless)","yes (harmless)","If the target doesn't eat on the day this spell is cast on it, the DC to avoid taking nonlethal damage from starvation on the following day doesn't increase by 1. This spell fails if the target hasn't already attempted at least one Constitution check to avoid starvation.","Villain Codex"
"Beacon Of Guilt","evocation","","curse","bard 2, inquisitor 2, occultist 2, sorcerer/wizard 2","1 standard action","V, S","0","touch","","","one object","24 hours or until discharged, then instantaneous","0","0","Will negates (object); see text","yes","You place an invisible ward upon an object that is triggered the first time a creature tries to move the object from its current location. The next creature to touch the object is cursed to become obvious  to everyone around it. The creature must succeed at a Will save or be surrounded in an aura of twinkling red light that functions as faerie fire (spell resistance applies). The curse bestowed by this spell cannot be dispelled, but a break enchantment, limited wish, miracle, remove curse, or wish spell can remove it.","Villain Codex"
"Escape Alarm","abjuration","","","bard 2, inquisitor 2, occultist 2, psychic 2, ranger 2, sorcerer/wizard 2, spiritualist 2, summoner/unchained summoner 2","1 standard action","V, S, F (a short segment of a chain)","0","medium (100 ft. plus 10 ft./level)","ten 10-foot cubes/level","","","24 hours","0","0","none","no","You place a ward on an area that notifies you when a creature exits it. This functions as alarm, except as noted. It alerts you when a creature leaves, rather than enters, the area, and you can't select a password to bypass its effects. Instead, when you place an escape alarm, you can attune up to one additional creature per caster level to the spell. You are automatically attuned to your own escape alarm and don't count against the limit. Attuned creatures can enter and exit the spell's area without triggering the alarm. If you select a mental alarm rather than an audible one, all attuned creatures receive the mental alert when someone exits the warded area.","Villain Codex"
"Outbreak","necromancy","","","antipaladin 2, bloodrager 3, cleric/oracle 2, druid 2, sorcerer/wizard 3","1 standard action","V, S","0","close (25 ft. + 5 ft./2 levels)","20-ft. burst","","","instantaneous","0","0","Fortitude partial","yes","You cause any diseased creatures in the area to become extremely contagious. Any affected creature is overcome by a fit of wracking coughs, causing it to become fatigued and exposing any creatures within 10 feet of the diseased creature to the diseases it carries. On a successful save, a creature is fatigued for 1 round and doesn't have a chance to infect nearby creatures.","Villain Codex"
"Virulent Miasma","necromancy","","","antipaladin 2, bloodrager 3, druid 3, sorcerer/wizard 3","1 standard action","V, S, M (a dried scab from a diseased creature)","0","medium (100 ft. + 10 ft./level)","","cloud spreads in 20-ft. radius, 20 ft. high","","1 round/level","0","0","Fortitude negates (see text)","see text","Virulent miasma creates fog like fog cloud, except that the vapors carry the taint of disease. Living creatures take a -4 penalty on saving throws against disease effects as long as they remain within the cloud and for 1d4+1 rounds after leaving. This effect of the spell allows a Fortitude save to negate it, and it is subject to spell resistance. A creature that succeeds at its saving throw against the fog (or ignores the fog due to spell resistance) is not affected and need not make further saves even if it remains in the fog.","Villain Codex"
"Cloak Of Shadows","illusion","shadow","evil, shadow","antipaladin 4, bard 5, mesmerist 5, sorcerer/wizard 5, spiritualist 5","1 standard action","V, S","0","personal","","","you","1 minute/level","0","0","","","You wrap yourself in a protective mantle of semi-real shadow. This grants a number of advantages: you gain concealment (20% miss chance), a +5 competence bonus on Stealth checks, and DR 5/good. This shroud of shadows also protects you from direct  sunlight, negating sunlight vulnerability, sunlight powerlessness, and similar effects.  When you are in dim light or darkness, the first two benefits increase against foes that don't have darkvision or the see in darkness ability (Pathfinder RPG Bestiary 2 301). Such creatures suffer a 50% miss chance (though you don't gain total concealment) and your competence bonus on Stealth checks increases to +10 with respect to such creatures.","Villain Codex"
"Shadow Claws","illusion","shadow","shadow","antipaladin 1, bard 2, bloodrager 2, magus 2, sorcerer/wizard 2, spiritualist 2","1 standard action","V, S","0","personal","","","you","1 minute/level","0","0","","","You summon a pair of claws over your hands formed from semi-real material. This grants you two primary claw attacks dealing 1d4 points of damage if you are Medium (1d3 if Small) plus 1 point of Strength damage. A successful Fortitude saving throw negates the Strength damage (DC = this spell's DC).","Villain Codex"
"Shadow Jaunt","illusion","shadow","shadow","antipaladin 3, bard 4, sorcerer/wizard 4, spiritualist 4, summoner/unchained summoner 4","1 standard action","V, S","0","close (25 ft. + 5 ft./2 levels)","","","you","instantaneous and 1 round; see text","0","0","","","You instantly travel between shadows to a point within range, though line of sight is not necessary. You leave a shadowy image of yourself in your former location and are wrapped in shadow at your destination; you can attempt a Stealth check as a free action to hide in your new location. Creatures that fail opposed Perception checks typically aren't aware that you are no longer at your former location unless they are familiar with this spell and identify the effects. Any attack on your former location causes the shadows to disperse, allowing any creature that can see your former location to immediately notice your disappearance. In addition, for 1 round, the envelope of shadow around you grants you concealment (20% miss chance). This spell doesn't function if there are no shadows within 5 feet of your starting location, and you can't travel through your own shadow. If you choose a destination that has no shadows, you appear from the shadow closest to your destination that's within the spell's range (this could be your starting location if there are no other shadows within the spell's range).","Villain Codex"
"Shield Of Wings","transmutation","","fire","cleric/oracle 3, inquisitor 3, paladin 3, ranger 3","1 standard action","V, S, DF","0","personal","","","you","1 minute/level (see below)","0","0","none","no","You gain five burning wings that grant a fly speed equal to the number of wings x 10 (average maneuverability) for an initial fly speed of 50 feet. The first time in a round where you would take fire damage, a wing vanishes (reducing the fly speed granted) and you gain fire resistance 30 for the remainder of the round. When you are down to one wing (and a fly speed of 10 feet), your maneuverability drops to poor. When you lose your final wing, you become immune to fire damage for 1 additional minute, after which the effects of this spell end.","Paths Of The Righteous"
"Charm Fey","enchantment","compulsion","mind-affecting","bard 1, sorcerer/wizard 1","1 standard action","V, S","0","close (25 ft. + 5 ft./2 levels)","","","one fey creature","1 hour/level","0","0","Will negates","yes","This spell functions as charm person, except it affects a fey instead of a humanoid.","The First World Realm Of The Fey"
"Hold Fey","enchantment","compulsion","mind-affecting","bard 2, cleric/oracle 2, inquisitor 2, sorcerer/wizard 3, witch 2","1 standard action","V, S, F/DF (a small, straight piece of iron)","0","medium (100 ft. + 10 ft./level)","","","one fey creature","1 round/level (D); see text","1","0","Will negates; see text","yes","This spell functions as per hold person, except it affects a fey instead of a humanoid.","The First World Realm Of The Fey"
"Locate Portal","divination","","","bard 2, cleric/oracle 2, druid 2, psychic 2, ranger 1, shaman 2, sorcerer/wizard 2, summoner/unchained summoner 2, witch 2","1 standard action","V, S","0","1 mile/level","circle, centered on you, with a radius of 1 mile/level","","","concentration, up to 1 minute/level","0","0","","","When this spell is active, you feel a mental pull in the direction of any active or operable portal leading to another plane within range of the spell. If multiple portals are present, you are pulled only to the nearest one. If moving causes you to become closer to a different portal, you become drawn to that one instead. The spell gives you the direction of the portal only, not a route. Once you are within 10 feet of the portal, you no longer feel the pull, only the portal's presence. The spell does not pinpoint or otherwise reveal hidden portals, nor does it do anything to aid in opening or operating them.","The First World Realm Of The Fey"
"Planar Orientation","divination","","","bard 1, cleric/oracle 1, druid 1, inquisitor 1, psychic 1, ranger 1, shaman 1, summoner/unchained summoner 1, witch 1, sorcerer/wizard 1","1 standard action","V, S","0","personal","","","you","instantaneous","0","0","","","This spell helps creatures accustomed to the concrete reality of the Material Plane to navigate within the confusing realities of other planes. When cast, it functions as know direction, save that instead of revealing true north, it reveals the direction of the palace or demesnes most associated with that plane or demiplane's ruling god or demigod, as well as a brief and generic vision of that entity's appearance or holy symbol. The spell functions only within whatever plane or demiplane you are located in at the time; for instance, if cast within a specific demon lord's Abyssal realm or on a given layer of Hell, it would point to the seat of power for that demon lord or archdevil, not Lamashtu or Asmodeus. If a plane or demiplane has multiple gods or rulers, such as the Eldest of the First World or Heaven's various Empyreal Lords and deities, it reveals the directions of the closest three, allowing for triangulation.  This spell reveals the location of the god or demigod's official seat of power only, not the entity itself, and if such a location is deliberately hidden via magic of any sort, the spell automatically fails. It does not function on the Material Plane.","The First World Realm Of The Fey"
"Fool's Gold","illusion","","","bard 1, medium 1, mesmerist 1, psychic 1, sorcerer/wizard 1","1 standard action","V, S, M (a copper piece or silver piece)","0","touch","","","objects touched","1 hour/level","0","0","none or Will disbelief (see text)","no","You can temporarily make copper or silver seem to be an equivalent amount of gold. The spell affects 1 gp/level worth of material (thus, at 3rd level, the spell affects up to 300 copper pieces, 30 silver pieces, or a copper or silver item worth no more than 3 gp). Coins increase in value as normal for the new type of coinage. For items other than coins, some of the value of the item comes from its craftsmanship, regardless of the metal used, so the value of the item seems to be 5 times (for silver items) or 50 times (for copper items) its true value. Thus, a copper candlestick originally worth 5 cp transformed by this spell appears to be worth 250 cp, or 2 gp and 5 sp. A successful DC 25 Appraise check automatically detects the true nature of the coins or items. Creatures inspecting or interacting with the coins or items can attempt a saving throw to disbelieve the illusion.","Villain Codex"
"Burning Entanglement","evocation","","","druid 3, ranger 3, shaman 3, witch 3","1 standard action","V, S, DF","0","long (400 ft. + 40 ft./level)","40-ft.-radius spread","","","1 round/level","0","0","Reflex negates or partial (see text)","no","This spell functions as per entangle, except it sets the foliage on fire. A creature that begins its turn entangled by the spell takes 4d6 points of fire damage (Reflex half), and a creature that begins its turn in the area but is not entangled takes 2d6 points of fire damage (Reflex negates). Smoke rising from the vines partially obscures visibility. Creatures can see things in the smoke within 5 feet clearly, but attacks against anything farther away in the smoke must contend with concealment (20% miss chance). When the spell's duration expires, the vines burn away entirely.","Villain Codex"
"Nature's Paths","divination","","","bard 1, druid 1, inquisitor 1, ranger 1, shaman 1, witch 1","1 standard action","V, S, M/DF (a smooth stone)","0","touch","","","one creature","8 hours (D)","1","0","Will negates (harmless)","yes (harmless)","The target instinctively knows the shortest, easiest, and fastest way through the wilderness. For the purpose of determining overland speed, the target treats any trackless terrain as though there were a trail or road, and any terrain with a road or trail as though there were a highway (Pathfinder RPG Core Rulebook 171-172). Up to one creature per caster level traveling with the target can also benefit from the effect. The spell functions only outdoors and does not function in magically altered terrain.","Villain Codex"
"Sand Table","divination","","","bard 3, medium 3, ranger 3, sorcerer/wizard 4","10 minutes","V, S, M (handful of sand)","0","see text","","","","1 hour/level (D)","1","0","none","no","Sand table allows you to create a scale model of the battlefield surrounding your position, showing numbers of troops, their relative positions, and their movement as if you were observing from a great height overhead (1,000 feet up). You cast the spell upon a table or other flat surface and cause the model to appear upon a 5-foot-by-5-foot section of that table or surface. It reflects accurate terrain and topography, though it doesn't identify fine topographical features or concealed or hidden topography. It also indicates all normally visible Small or larger creatures within the area of effect, but it doesn't provide identifying characteristics of those creatures; each creature appears as an indistinct speck, under 1 millimeter in each dimension.  The spell marks obvious war camps and contingents of troops with a symbol of their banner (if they openly carry such a symbol). The spell provides a snapshot of the topography and creature locations when cast; it doesn't adjust for changes that occur during the duration. The table shows the land surrounding itself up to a 1-mile radius from the surface. The sand table does not reveal invisible or incorporeal creatures, nor does it include creatures that are underground, indoors, submerged below the surface of water, below a tree line or other source of cover from above, or flying above 1,000 feet in the air. Those looking at the table can spot Small and larger creatures that are using Stealth to hide, but they take a -10 penalty on their Perception checks because of the size of the models.  Once the spell has been cast, if anything moves or shakes the surface upon which it was placed, the spell ends instantly.","Villain Codex"
"Dousing Rain","evocation","","water","bard 2, druid 2, shaman 2, witch 2","1 standard action","V, S, M/DF (a drop of water)","0","medium (100 ft. + 10 ft./level)","cylinder (10-ft. radius, 40 ft. high)","","","1 round/level (D)","1","0","none","no","With a beckoning gesture, you call forth a downpour of rain. For the duration of the spell, the following effects apply within the affected area. Nonmagical fires are automatically extinguished, and all creatures and objects in the area gain fire resistance 5. The conjured water is conductive, and whenever a doused creature takes electricity damage, it takes 1 additional point of electricity damage. At 6th, 12th, and 18th levels, the fire resistance increases by 5 and the additional electricity damage increases by 1 point.","Villain Codex"
