"name","school","subschool","descriptor","spell_level","casting_time","components","costly_components","range","area","effect","targets","duration","dismissible","shapeable","saving_throw","spell_resistance","description","source"
"Blood Money","transmutation","","","magus 1, sorcerer/wizard 1, witch 1","1 swift action","V, S","0","0 ft.","","1 material component","","Instantaneous","0","0","","","You cast blood money just before casting another spell. As part of this spell's casting, you must cut one of your hands, releasing a stream of blood that causes you to take 1d6 points of damage. When you cast another spell in that same round, your blood transforms into one material component of your choice required by that second spell. Even valuable components worth more than 1 gp can be created, but creating such material components requires an additional cost of 1 point of Strength damage, plus a further point of damage for every full 500 gp of the component's value (so a component worth 500-999 gp costs a total of 2 points, 1,000-1,500 costs 3, etc.). You cannot create magic items with blood money.  For example, a sorcerer with the spell stoneskin prepared could cast blood money to create the 250 gp worth of diamond dust required by that spell, taking 1d6 points of damage and 1 point of Strength damage in the process.  Material components created by blood money transform back into blood at the end of the round if they have not been used as a material component. Spellcasters who do not have blood cannot cast blood money, and those who are immune to Strength damage (such as undead spellcasters) cannot use blood money to create valuable material components.","RotRL-AE-Appendix"
"Covetous Aura","abjuration","","","bard 5, sorcerer/wizard 5","1 standard action","V, S","0","personal","25-ft.-radius emanation centered on you","","","1 round/level or until discharged","0","0","none","no","Anytime a harmless (so noted by a spell's saving throw description) spell of 3rd level or lower is cast within a covetous aura's area of effect, you may choose to immediately gain the benefit of that spell as if it had also targeted you. The intended target still gains the effect of the spell. You gain the benefits of this duplicated spell only if the caster is in range of the covetous aura. You are considered the caster of the additional spell effect. If the effect allows for multiple targets other than yourself, you cannot use the stolen spell effect to target other creatures-a covetous aura only aids you. Once you choose to gain the benefit of another spell, the covetous aura immediately ends. Rumors hold that this unusual spell was invented thousands of years ago by Runelord Belimarius, who was constantly jealous of other spellcasters' abilities.","RotRL-AE-Appendix"
"Deathwine","necromancy","","","alchemist 2, cleric/oracle 2, sorcerer/wizard 3, witch 3","1 minute","V, S","0","touch","","","1 potion touched/level","1 hour/level","0","0","none (object)","no (object)","This spell allows you to turn a potion into a temporary pool of necromantic energy. Only a potion created using a conjuration (healing) spell can be affected by this spell. An affected potion turns dark red and reveals a necromantic aura if detect magic is cast on it while it remains under this spell's effects.  When you drink a potion affected by this spell, you do not gain the potion's normal effect. Instead, the first necromancy spell you cast within the next minute is cast at a higher caster level. The bonus to caster level is equal to the spell level of the spell used to create the potion that deathwine affects. For example, a 5th-level wizard who drinks deathwine made from a potion of cure serious wounds would cast his next necromancy spell as an 8th-level caster, as cure serious wounds i s a 3 rd-level spell.  In addition, any undead creature (or other creature healed by negative energy) that drinks a potion affected by deathwine is healed of 1d8 points of damage. Any potion not imbibed before this spell's duration expires is destroyed at the end of the deathwine's duration.","RotRL-AE-Appendix"
"Sign Of Wrath","evocation","","force","cleric/oracle 6, sorcerer/wizard 6","1 standard action","V, S, F (a gem worth 1,000 gp inscribed with the Thassilonian symbol of wrath)","1","personal","25-ft.-radius burst centered on you","","","instantaneous","0","0","Reflex half","yes","A giant, glowing symbol of wrath appears below you, forcibly repulsing all nearby creatures. All creatures within the area of effect take 1d6 points of force damage per caster level (maximum 15d6) and are subjected to a bull rush that attempts to push them directly away from you. The blast's bull rush effect has a CMB bonus equal to your caster level + your Intelligence, Wisdom, or Charisma modifier (whichever is highest). You are unaffected by both the spell's damage and its bull rush effect, and may select up to one creature per 4 caster levels to also be ignored by the spells effects.","RotRL-AE-Appendix"
"Swipe","conjuration","teleportation","","bard 2, sorcerer/wizard 3","1 standard action","V, S","0","close (25 ft. + 5 ft./2 levels)","","","one held item","instant","0","0","none","no","By flicking a finger in the appropriate direction and proclaiming ownership, you attempt to magically wrest an item from the target's grip and summon it to your hand. To claim an object held by an opponent, you must make a CMB check-this check has a bonus equal to your caster level + your Intelligence, Wisdom, or Charisma modifier (whichever is highest). If you fail this check, the target retains the item and the spell fails. If you succeed, the item teleports into one of your free hands or comes to rest at your feet.","RotRL-AE-Appendix"
"Unconscious Agenda","enchantment","compulsion","language-dependent, mind-affecting","bard 6, inquisitor 6, sorcerer/wizard 6, witch 6","10 minutes","V","0","Close (25 ft. + 5 ft./2 levels)","","","One humanoid","One week/level or until discharged (D)","1","0","Will negates","yes","This spell plants a subconscious directive in the target's mind that forces him to act as you dictate when specific circumstances arise. The target humanoid can be either conscious or unconscious, but must understand your language. Upon casting this spell, you must state a course of action you wish the target to take. This course of action must be described in 20 words or fewer. You must then state the condition under which you wish the target to take this action, also describing it in 20 or fewer words. Actions or conditions more elaborate than 20 words cause the spell to fail. Unconscious agenda cannot compel a target to kill himself, though it can compel him to perform exceedingly dangerous acts, face impossible odds, or undertake almost any other course of activity. You cannot issue new commands to the target after the spell is cast.  If the target fails his save against this spell, he is not compelled to act in any way until the specified trigger circumstances are encountered. He also has no knowledge of the details of the spell affecting him, and has no memory of the last 10 minutes (although he might come to notice the missing time or the presence of the caster). He can function as he wishes until the events you detailed as the condition take place. Upon experiencing the prerequisite condition, the target is forced to perform the course of action you described as per the spell dominate person. (If the compelled action is against the victim's nature, he immediately gains a new saving throw at a +5 bonus against the spell to end its effects.) For the next hour, the target acts as you dictated, doing all he can to fulfill your command. If, at the end of the hour, the target still has not completed your command, the target is released from the enchantment and the spell ends. Once the course of action is completed, the spell ends. The target has full memory of acts performed during this hour.  It's difficult to detect an unconscious agenda before the spell is triggered. Casting detect magic on one affected by it only reveals an aura of enchantment if the caster of detect magic has a higher caster level then the caster of unconscious agenda. Even if the spell is detected, it can only be removed by break enchantment, limited wish, remove curse, miracle, or wish. Dispel magic does not affect unconscious agenda.","RotRL-AE-Appendix"
"Ironbloom Sprouts","transmutation","","","cleric/oracle 1, druid 1","1 standard action","V, S, DF, M (1 gp worth of powdered iron)","1","touch","","","2d4 fresh mushrooms touched","1 day/level","0","0","none","yes","This spell functions like goodberry, except as noted above and that it transforms 2d4 mushrooms into magical ironbloom mushrooms rather than transforming common berries into magical berries. Alternatively, you may create twice as many mushrooms, but each only has the nourishment ability of a goodberry and not the healing properties.","AP 62"
"Bed Of Iron","necromancy","","","inquisitor 1, magus 1, paladin 1, sorcerer/wizard 1","1 standard action","V, S, M (a feather or swatch of soft fabric)","0","touch","","","one creature touched/level","8 hours","0","0","Fortitude negates (harmless)","yes (harmless)","This spell makes even the clunkiest armor feel soft as silk to the wearer. The subjects of this spell are able to sleep comfortably in medium or heavy armor without suffering from fatigue the following day.","Knights Of The Inner Sea"
"Carry Companion","transmutation","","","druid 2, paladin 2, ranger 2, sorcerer/wizard 2, witch 2","1 standard action","V, S, M (a pinch of sand or limestone dust)","0","touch","","","one willing creature touched","permanent; see text","0","0","none","yes (harmless)","You touch an animal or magical beast that has a helpful attitude toward you, instantly transforming the creature into a miniature figurine of stone, small enough to fit into the palm of your hand. Creatures with an attitude of less than helpful will not tolerate this spell, and it automatically fails to work on them. An intelligent animal or magical beast must be a willing subject in order for this spell to take effect. Any items that the creature wears (such as a harness or saddle) or carries (such as those stowed in saddlebags) are transformed along with the creature.  While miniaturized, the creature is under an effect similar to that of a flesh to stone spell: It is mindless and inert, and does not seem alive when viewed with spells like deathwatch. However, you may return the creature to its normal form at any time simply by placing the figurine on the ground, touching it, and uttering a word of command. Otherwise, the creature remains in miniature form unless the spell is broken, such as by dispel magic or stronger magic. Unlike a flesh to stone spell, a creature affected by carry companion is unaffected by stone to flesh. If the miniature figurine is broken or damaged, the creature (if returned to its original state) has similar damage or deformities.","Knights Of The Inner Sea"
"Clarion Call","illusion","","","bard 1, cleric/oracle 1, magus 1, sorcerer/wizard 1","1 standard action","V, S, M (a piece of brass)","0","touch","","","creature touched","10 minutes/level","0","0","Fortitude negates (harmless)","yes (harmless)","The subject of this spell gains two benefits. First, the affected creature gains the ability to create a sound like the blast of a mighty horn or trumpet simply by miming the action of sounding one. Second, the subject can speak in a booming voice that carries easily over great distances, lowering the DC of any check to hear what is said by -15. This spell is particularly prized by battlefield commanders and champions who wish to make themselves clearly heard or gain the attention of their allies or foes.","Knights Of The Inner Sea"
"Emblazon Crest","transmutation","","","magus 1, paladin 1, sorcerer/wizard 1","1 standard action","S, F (an example of the crest or coat of arms)","0","touch","","","creature touched","1 hour/level","0","0","Will negates (harmless)","yes (harmless)","This spell ensures the subject touched is always able to display her proper crest and coat of arms. Any tabard or tunic worn and any shield carried by the subject while this spell is active can be made to display a coat of arms when the spell is cast. For example, even if the subject picks up a different shield, it still displays the subject's crest, regardless of the shield's normal appearance.","Knights Of The Inner Sea"
"Keep Watch","enchantment","","","inquisitor 1, magus 1, paladin 1, ranger 1, sorcerer/wizard 1","1 standard action","V, S","0","touch","","","one creature touched/2 levels","8 hours or less; see text","0","0","Will negates (harmless)","yes (harmless)","This spell enables the subjects to stand watch or keep vigil throughout the night without any ill effects. The subjects suffer no fatigue and gain all the usual benefits of a full night's rest. The subjects gain hit points as though from resting, wizards may prepare their spells as though they had slept for 8 hours, and so on. Effects that rely on actual sleep or dreaming are ineffective, though the subjects are still susceptible to effects that would put them to sleep, such as sleep or deep slumber. Any vigorous activity, including fighting, immediately ends the effect, and the affected creatures must either have the spell cast on them again or sleep for the remaining hours to avoid fatigue and gain the benefits of a full night's rest.","Knights Of The Inner Sea"
"Serren's Armor Lock","transmutation","","","magus 2, sorcerer/wizard 3, witch 3","1 standard action","V, S, M (a pinch of rust)","0","medium (100 ft. + 10 ft./level)","","","one armored creature","1 round/level (D)","1","0","Reflex partial; see text","yes","Upon pointing at an armored foe, you cause all of the joints of the target's armor to stiffen as otherworldly chains wrap around the target. On a failed Reflex save, a target in heavy metal armor becomes staggered. A target in light or medium metal armor instead becomes entangled. Targets wearing no armor or nonmetallic armor are unaffected. If the target is wearing heavy metal armor and succeeds at its Reflex save, it becomes entangled instead of staggered; a target in light or medium metal armor that succeeds at its saving throw is unaffected by the spell.","Knights Of The Inner Sea"
"Serren's Swift Girding","transmutation","","","magus 1, paladin 1, sorcerer/wizard 1","1 standard action","V, S, M (the armor to be worn)","0","close (25 feet + 5 feet/level)","","","one willing creature/level","instantaneous","0","0","none","yes (harmless)","With a sweep of your hand, you select a number of targets and the same number of suits of armor. The targets of this spell are immediately clad in the armor that you choose. The subjects of the spell must be capable of wearing the chosen armor, cannot be wearing other armor, and must be able to properly fit into the chosen armor. The chosen armor must be empty and cannot be currently worn by another creature (thus you cannot move armor from one wearer to another with this spell). Creatures armored with this spell are considered to have donned the armor properly.","Knights Of The Inner Sea"
"Ward Shield","abjuration","","","cleric/oracle 4, inquisitor 4, magus 4, sorcerer/wizard 4","1 standard action","V, S","0","touch","","","shield touched","1 minute/level","0","0","Will negates (harmless)","yes (harmless)","With a touch, you enchant a shield and enable it to protect its wielder from hostile spells. The shield grants spell resistance 10 + your caster level against spells so long as the shield can be interposed between the wielder and the spell effect. A spell shield does not provide spell resistance against area effect spells such as fireball, but does provide a +5 bonus on Reflex saving throws against such spells.","Knights Of The Inner Sea"
"Curse Item","necromancy","","curse","cleric/oracle 2","1 minute","V, S, DF","0","touch","","","object touched","instantaneous","0","0","Will negates (object)","yes (object)","The object becomes flawed and prone to failure. The effects of this spell depend on the nature of the object.  Magic Item: The item functions intermittently, gaining either an unreliable curse or a random dependent curse (Pathfinder RPG Core Rulebook 536).  Nonmagical Armor or Shield: The item gains the fragile armor quality (Pathfinder RPG Ultimate Equipment 8).  Nonmagical Weapon: The item gains the fragile weapon quality (Ultimate Equipment 22).  Tool: The item gains the broken condition if a creature rolls a natural 1 while making a skill check with the tool.  Other Item: Each day it is used, the item has a 5% chance of gaining the broken condition.  This spell does not affect artifacts. The item can be sold or discarded as normal (the bearer is not compelled to keep it). If a cleric of Groetus is using an item that is affected by this spell, he or she may make a DC 20 Will saving throw to override the item's curse for 1 day (using it as if the item were not cursed).","AP 64"
"Lissalan Snake Sigil","see text","","","cleric/oracle 3, sorcerer/wizard 3","10 minutes","V, S, M (powdered amber worth 500 gp and a snake scale)","1","touch","","","one touched book or written work","permanent until discharged; 1 day/level; see text","0","0","Reflex negates","no","There are seven variants of this spell, one for each of the Thassilonian schools of magic. Each functions like sepia snake sigil (and counts as that spell for the purpose of combining other spells that hide or garble text), except instead of trapping the subject, the triggered sigil's effect depends on this spell's school. This effect lasts for 1 day/level. This is a curse effect that can be removed via remove curse.  Abjuration: All beneficial magical effects on the target last half as long as normal.  Conjuration: The target is nauseated. This is a poison effect.  Enchantment: The target takes a 1d6 penalty to Intelligence, Wisdom, and Charisma. This is a compulsion effect.  Evocation: The target gains vulnerability to an energy type, chosen randomly from the following: acid, cold, electricity, or fire. This is an acid, cold, electricity, or fire effect.  Illusion: The target's vision is blurred, giving it a -4 penalty on Perception checks relating to vision, and the target treats all other creatures as having displacement. This is a glamer effect.  Necromancy: The target is exhausted. This condition cannot be removed with rest.  Transmutation: Target is affected by slow.","AP 65"
"Display Aversion","illusion","shadow","","bard 2, cleric/oracle 2, inquisitor 2, sorcerer/wizard 3, witch 2","1 standard action","V, S, M (a drop of holy water)","0","personal","","","you","concentration + 1d4 rounds","0","0","","","This spell functions like minor image, except it always creates an animated illusion of you presenting to a vampire a material, object, or sound that it is averse to, such as garlic, a holy symbol, or bells ringing. You specify what aversion the illusion depicts when you cast the spell. The vampire reacts to the illusion as if it were real; it can overcome the effect by succeeding at a disbelief save or a normal Will save against the illusion's DC (instead of the normal DC 25 to overcome its revulsion). The illusion is only quasi-real and cannot otherwise affect creatures.","Blood Of The Night"
"Domination Link","divination","","mind-affecting","bard 3, inquisitor 3, sorcerer/wizard 3, witch 3","1 standard action","V, S, F/DF (a copper piece)","0","60 ft.","cone-shaped emanation","","","concentration, up to 1 min./level (D)","1","0","Will negates; see text","no","This spell functions like detect thoughts, with the additional ability to find echoes of the thoughts of a creature mentally controlling the target. For example, if the target has been dominated by a vampire, you can use evidence left in the target's mind to learn about that vampire. Each minute you concentrate on the spell, you can learn your choice of one of the following pieces of information.  Direction: The controller's general direction and distance.  Emotion: The controller's emotional state (gloating, sated, frightened, angry, and so on).  Image: A powerful iconic image relevant to the controller or its connection to the target, such as a symbol on a door or a name on a gravestone.  Location: The controller's general location, such as ""in a large city"" or ""on a ship.""  Name: The name by which the target knows its controller (if any).  All of this information is based on the last time the influencing creature linked itself to the target, either to issue a command or to receive sensory input from the target. For example, if at nightfall a vampire commanded a dominated victim to walk to a cemetery, this spell can reveal the vampire's general location at that time, though it may have moved since then.","Blood Of The Night"
"Project Weakness","necromancy","","curse, evil","cleric/oracle 3, sorcerer/wizard 4, witch 3","1 standard action","V, S","0","touch","","","living creature touched","permanent","0","0","Will negates","yes","You curse the target with the weaknesses of your kind of vampirism. The creature reacts to garlic, mirrors, ringing bells, sunlight, and so on as if it were a vampire of the same type as you. This cannot kill the target; anything that would kill it (such as a lengthy exposure to sunlight if you are a moroi vampire) renders it helpless until the curse or the harmful effect is removed. The target gains none of the benefits of being a vampire (such as fast healing or requiring special ways to be permanently killed), only the penalties.","Blood Of The Night"
"Steal Years","transmutation","","","cleric/oracle 3, druid 3, sorcerer/wizard 3, witch 3","1 standard action","V, S, M (a handful of ash)","0","touch","","","creature touched","24 hours","0","0","Fortitude negates","yes","You temporarily drain youth and vitality from the target and channel it into yourself. If the target fails its Fortitude save, it physically ages 1d4 years per two caster levels (maximum 5d4), and you decrease your age by the same number of years. If this changes the age category of you or the target, only adjust physical ability scores. This effect cannot bring your age to lower than the minimum age of adulthood for your race (see page 169 of the Core Rulebook). This stolen youth does not actually change your age or prolong your life; you will still die at your allotted time, no matter how youthful you appear. Likewise, the spell does not add to the target's true age, and cannot make the target die of old age.  When the spell ends, the sudden weight of aging makes you fatigued for 1d4 hours.","Blood Of The Night"
"Steal Years, Greater","transmutation","","","cleric/oracle 5, druid 5, sorcerer/wizard 5, witch 5","1 standard action","V, S, M (a handful of ash)","0","touch","","","creature touched","1 day/level","0","0","Fortitude negates","yes","This spell functions like steal years, except you drain 1d6 years per two caster levels (maximum 10d6).","Blood Of The Night"
"Transmute Wine To Blood","transmutation","","","cleric/oracle 2, sorcerer/wizard 2, witch 2","1 standard action","V, S, M (drop of animal blood)","0","touch","","","bottle of wine worth at least 10 gp","instantaneous","0","0","Fortitude negates (object)","yes (object)","You transform one bottle of fine wine into 1 pint of animal blood, sufficient for a creature with the blood drain ability to feed upon as if it came from a Medium animal with 1 Hit Die. If you are using the optional hunger rules (see page 22), this blood satiates an undead creature's hunger, negating any withdrawal effects, but does not grant the creature a feeding bonus. The blood coagulates and spoils at the normal rate.","Blood Of The Night"
"Winter's Grasp","conjuration","creation","cold","druid 2, witch 2","1 standard action","V, S, M/DF (ground glass)","0","medium (100 ft. + 10 ft./level)","20-ft.-radius spread","","","1 round/level","0","0","none","no","Ice encrusts the ground, radiating supernatural cold and making it difficult for creatures to maintain their balance. This icy ground is treated as normal ice, forcing creatures to spend 2 squares of movement to enter an icy square and increasing the DC of Acrobatics checks attempted in the area by 5. A creature that begins its turn in the affected area takes 1d6 points of cold damage, and takes a -2 penalty on saving throws against all spells with the cold descriptor for 1 round.","People Of The North"
