"name","school","subschool","descriptor","spell_level","casting_time","components","costly_components","range","area","effect","targets","duration","dismissible","shapeable","saving_throw","spell_resistance","description","source"
"Night Blindness","necromancy","","curseUM","antipaladin 1, bard 1, bloodrager 1, cleric/oracle 2, mesmerist 1, psychic 1, shaman 2, sorcerer/wizard 1, spiritualist 2, witch 1","1 standard action","V","0","medium (100 ft. + 10 ft./level)","","","one living creature","1 day/level (D)","1","0","Will negates (harmless)","no","Your target's vision becomes impaired as if the light level were one step lower, treating bright light as normal light, normal light as dim light, and dim light as darkness. In addition, the subject gains no benefit from darkvision, low-light vision, or the see in darkness ability. The subject gains a +4 bonus on saving throws to resist the blind or dazzled condition caused by bright light (such as flare). Remove blindness/deafness dispels night blindness.","Black Markets"
"Pesh Vigor","transmutation","","","alchemist 1, antipaladin 1, bloodrager 1, cleric/oracle 1, druid 1, magus 1, medium 1, psychic 1, shaman 1, sorcerer/wizard 1, summoner/unchained summoner 1","1 standard action","V, S, M (a dose of pesh worth 15 gp)","1","touch","","","living creature touched","1 round/level; see text","0","0","Will negates","yes","The target gains a +2 enhancement bonus to its Strength. Once per round as a free action, the target can choose to increase the enhancement bonus by 2 for 1 round; if it does so, it takes 1d6 points of nonlethal damage and the spell's duration decreases by 1 additional round. For every 5 caster levels you have, the target can choose to increase the enhancement bonus by an additional 2, taking an additional 1d6 points of nonlethal damage and decreasing the duration by 1 additional round per increase to the Strength bonus, to a maximum enhancement bonus of +10 and 4d6 points of nonlethal damage at caster level 15th. The subject can't spend more rounds than remain in the duration. When the spell ends, the subject becomes fatigued.","Black Markets"
"Compel Tongue","enchantment","compulsion","mind-affecting","bard 1, cleric/oracle 2, druid 2, medium 2, mesmerist 2, sorcerer/wizard 2, witch 2","1 standard action","V, S, M (a wooden block carved with a letter)","0","touch","","","one creature","1 hour/level (D)","1","0","Will negates","yes","This spell functions as share language (Pathfinder RPG Advanced Player's Guide 243), granting a creature the ability to read, understand, and communicate to the best of its ability in any one language you know. For the spell's entire duration, the target can speak and write only in the language imparted, but its ability to understand other languages is unaffected.","Black Markets"
"Compel Tongue, Mass","enchantment","compulsion","mind-affecting","bard 4, cleric/oracle 5, druid 5, medium 4, mesmerist 4, sorcerer/wizard 5, witch 5","1 standard action","V, S, M (a wooden block carved with a letter)","0","touch","","","one creature/level, no two of which can be more than 30 ft. apart","1 hour/level (D)","1","0","Will negates","yes","This spell functions as compel tongue, except it affects multiple creatures. The same language restriction applies to all creatures, and the same language must be imparted to all creatures affected by the same casting of this spell.","Black Markets"
"Fleeting Memory","enchantment","compulsion","mind-affecting","bard 3, mesmerist 2, occultist 3, psychic 3, sorcerer/wizard 4","1 standard action","V","0","close (25 ft. + 5 ft./2 levels)","","","one creature","1 round/level (D)","1","0","Will partial","yes","You create a gap in the target's memory, preventing the target from remembering anything that happens from the moment you cast this spell until the moment its complete duration ends. Fleeting memory doesn't wipe out its target's memories until the end of its duration, so the target can remember the preceding rounds until the spell's duration ends. If the spell ends prematurely, either because you dismiss it or because it is dispelled, it disperses without affecting its target's memory.  Whether or not the target's save is successful, the target forgets that you cast a spell.","Black Markets"
"Fleeting Memory, Mass","enchantment","compulsion","mind-affecting","bard 6, mesmerist 5, occultist 6, psychic 7, sorcerer/wizard 8","1 standard action","V","0","close (25 ft. + 5 ft./2 levels)","","","one creature/level, no two of which can be more than 30 ft. apart","1 round/level (D)","1","0","Will partial","yes","This spell functions as fleeting memory, except that it affects multiple creatures.","Black Markets"
"Secret Sign","illusion","glamer","","bard 1, inquisitor 1, shaman 1, sorcerer/wizard 2, witch 2","1 standard action","V, S, M (a lemon peel)","0","touch","","","one creature or object","1 day/level","0","0","Will negates (object)","yes (harmless, object)","You invisibly inscribe a small mark or short message (no more than 25 words) on a creature or object, similar to the way arcane mark works. The sign can be no more than 6 inches across, and if it's a written message, it can be in any language you can read and write at the time of the spell's casting. As you cast the spell, you can define one auditory, olfactory, tangible, or visual criterion-such as all creatures wearing green bands on their left arms or only creatures who smell of lavender or only orcs-that allows designated creatures within 30 feet to see the secret sign.  Disguises and illusions that mimic the set criterion can fool this spell. Normal darkness doesn't conceal a visual trigger, but magical darkness or invisibility does. Auditory criteria (such as a password) and tangible criteria (such as pressing your hand against a specific object or wall) can be performed by anyone who learns of them. A secret sign cannot distinguish alignment, level, Hit Dice, or class except by external garb, but can differentiate apparent races, genders, and garments. See invisibility and invisibility purge reveal the sign, but glitterdust does not.  A caster of at least 10th level can make secret sign permanent on an object with a permanency spell using 5,000 gp of diamond dust as a material component.","Black Markets"
"Venomous Promise","transmutation","","language-dependent, poisonUM","antipaladin 3, bard 3, mesmerist 3, shaman 3, witch 3","1 standard action","S, M (a vial of poison)","0","touch","","","one creature","permanent or until triggered","0","0","yes","yes","You guard your words and person with poisonous power. You can impart a short amount of information-up to 25 words-as you cast this spell, entwining your words with the poison provided as a material component. If your target reveals the information you impart (verbally, in writing, with gestures, or by having its mind read with spells like detect thoughts), the target is immediately exposed to the poison (and is allowed any saving throw the poison allows).  Your target instinctively knows that revealing this information will endanger it, but doesn't automatically understand why or how. Neutralize poison removes the effect of this spell; the spellcaster must succeed at a caster level check against the spell's save DC rather than the poison's.","Black Markets"
"Arcane Pocket","conjuration","creation","","sorcerer/wizard 1","1 standard action","V, F (a pocket and a silver button)","0","touch","","extradimensional space up to 1 cu. ft./level","","1 hour/level","0","0","none","no","With a touch, you conjure an extradimensional space inside a pouch or pocket. The pocket acts as a bag of holding, except it can hold only 10 pounds per caster level. Regardless of what is placed into the pocket, it weighs 3 pounds. Unlike a bag of holding, the pocket created by this ability cannot be overloaded or ruptured-any additional material simply spills out of the top-nor does it have any special interaction with other kinds of extradimensional spaces.  An arcane pocket grants you a +1 bonus on Sleight of Hand checks to conceal its contents. The pocket becomes nonmagical, spilling all of its contents onto the ground unharmed, if it leaves your possession or you create a new arcane pocket.","Black Markets"
"Vacuous Vessel","illusion","glamer","","bard 0, sorcerer/wizard 0","1 swift action","V","0","touch","","","container touched","1 round/level (D)","1","0","Will negates; see text","yes; see text","This spell makes a single bag, chest, sack, or other container look and feel empty. The container must be no larger than 1 cubic foot per caster level or the spell fails. Anyone peering into or reaching into the container must succeed at a Will save or perceive the container as being completely empty. All items within the container when the spell was cast are still present, but they can't be noticed unless removed from the bag-such as by someone who can perceive them, or who upends the container.  Casting vacuous vessel on another container or placing a new item in the existing container immediately dismisses the currently active spell.","Black Markets"
"Adroit Retrieval","transmutation","","","occultist 3, sorcerer/wizard 3","1 standard action","V, S","0","touch","","","creature touched","1 minute/level","0","0","Will negates (harmless)","yes (harmless)","You instill the target with the ability to withdraw small items from her pockets or packs with supernatural swiftness. When the target retrieves an item stored on itself, it can retrieve  the item either as a move action without provoking attacks of opportunity, or as a swift action that provokes attacks of opportunity. This effect functions only when the target attempts to retrieve a stored item that weighs less than 1 pound per caster level (maximum 15 pounds).","Black Markets"
"Authenticating Gaze","divination","","","alchemist 1, cleric/oracle 1, inquisitor 1, occultist 1, sorcerer/wizard 1","1 standard action","V, S, DF/M (a miniature magnifying glass or spectacles)","0","personal","","","","1 minute/level","0","0","","","Your understanding of the written word becomes analytical and discerning. You gain an insight bonus equal to your caster level (maximum +10) on Appraise checks to determine the value of books and scrolls and on Linguistics checks to detect forgeries, and you can attempt a Linguistics check to detect a forged document at a glance, rather than taking the normal 1 round of examination per page. In addition, you immediately detect whether written works within 30 feet and within your line of sight have a magical aura and the strength of any such auras, as though you had concentrated on each written work for 1 round using detect magic.","Black Markets"
"Curse Of Keeping","enchantment","compulsion","curseUM","antipaladin 2, mesmerist 2, shaman 2, witch 2","1 standard action","V, S, DF","0","close (25 ft. + 5 ft./2 levels)","","","one creature","1 day/level","0","0","Will negates","yes","You curse the target with the inability to sell, barter, or give away any item it owns, other than ordinary currency, for as long as the spell remains in effect. The target cannot sell, trade, drop, or give away possessions. The target can purchase items using ordinary currency but can't then sell the purchased items. The target can accept gifts from others but can't offer anything in exchange. A curse of keeping can be ended by break enchantment, limited wish, remove curse, miracle, or wish. Dispel magic does not affect a curse of keeping.","Black Markets"
"Evaluator's Lens","conjuration","creation","","inquisitor 2, occultist 3, sorcerer/wizard 3, summoner/unchained summoner 2, witch 3","1 standard action","V, S","0","personal","","","","1 minute/level or until discharged","0","0","","","You summon an insubstantial lens of force 4 inches in diameter that hovers in front of your face. When you attempt a saving throw against a spell with the figment or pattern descriptor, you can roll twice and take the higher result. You gain a +10 enhancement bonus on Appraise checks to appraise the worth of an item viewed through the lens, and you never judge an item's value wildly inaccurately. If you successfully identify that the item has magical properties, you can immediately attempt a Spellcraft check to determine the item's properties, as if you had cast detect magic on the item and examined it for 3 rounds. This spell cannot determine the properties of artifacts.  The lens cannot be targeted or harmed by physical attacks, but dispel magic, disintegrate, or a rod of cancellation affects it. The lens's AC against touch attacks is equal to 10 + your Dexterity modifier.","Black Markets"
"Fleeting Defect","transmutation","","","bard 2, bloodrager 2, magus 2, sorcerer/wizard 2","1 standard action","V, S","0","close (25 ft. + 5 ft./2 levels)","","","one solid object that does not have the broken condition, or one construct","1 minute/level (D)","1","0","Fortitude negates (harmless, object); see text","no","You cause a single object to temporarily gain the broken condition. The target must be a single solid object, regardless of its composition, weighing up to 10 pounds per caster level. Attended objects are allowed a Fortitude save. When this spell ends, the object reverts to its original quality. An item destroyed while under the effects of this spell remains destroyed when this spell ends.  This spell can be cast on a single construct to disrupt its animating force. A construct that fails its saving throw takes a -2 circumstance penalty on attack rolls, saving throws, skill checks, and ability checks for the duration of the spell.","Black Markets"
"Incendiary Runes","abjuration","","fire","occultist 1, sorcerer/wizard 1","1 standard action","V, S","0","touch","","","one touched object weighing no more than 10 lbs.","permanent until discharged (D)","1","0","Reflex partial","yes","This spell functions as explosive runes, except it creates a small surge of flames rather than an explosion of force. The runes automatically deal 1d6 points of fire damage to any creatures and objects in adjacent squares, and those creatures and objects catch fire unless they succeed at Reflex saves.","Black Markets"
"Peerless Integrity","illusion","glamer","","antipaladin 2, bard 2, mesmerist 2, psychic 2, sorcerer/wizard 2","1 standard action","V, S, DF","0","personal","10-ft.-radius emanation centered on you","","","10 minutes/level","0","0","none or Will negates; see text","none","Peerless integrity conceals the alignment of creatures from divination magic. All creatures within the spell's area, including you, appear to have lawful good auras for the purposes of divination spells and effects that reveal alignments (such as detect law and see alignmentUC), instead of their actual alignments. If the caster of such divination magic succeeds at a Will save, the caster recognizes whether the readings are true or false. Any creature under the effects of this spell gains a +2 circumstance modifier on Bluff and Diplomacy checks.  This spell does not affect other types of divination magic (such as detect thoughts or discern lies) and does not protect against spells or effects that cause harm based on targeted creatures' alignments.","Black Markets"
"Remarkable Legerdemain","transmutation","","","bard 2, sorcerer/wizard 2","1 standard action","V, S","0","personal","","","you","1 minute/level (D)","1","0","","","While this spell is in effect, your body and clothing flutter and distort subtly, allowing you to conceal items with uncanny skill. You treat any object you can hold in one hand as a coin-sized object for the purposes of Sleight of Hand checks to palm the object or make it disappear; however, you can hide only one such item per caster level on your person at one time. This effect does not change the actual sizes of the objects.","Black Markets"
"Secret Coffer","conjuration","summoning","","sorcerer/wizard 3, witch 3","10 minutes","V, S, F (the chest and its replica)","0","see text","","","one small chest or coffer and up to 1 cu. ft. of goods","60 days or until discharged","0","0","none","no","This spell functions like secret chest, except the coffer is only 1 foot square and can contain only 1 cubic foot of goods, and the container can remain safely hidden on the Ethereal Plane for only 14 days before it risks becoming lost. The spell automatically fails if a living creature enters the coffer. The coffer used as a focus for secret coffer must cost at least 500 gp, and its replica costs 5 gp.","Black Markets"
"Secret Vault","conjuration","summoning","","sorcerer/wizard 8, witch 8","10 minutes","V, S, F (the chest and its replica)","0","see text","","","one chamber and up to 10 cu. ft. of goods/caster level","60 days or until discharged","0","0","none","no","This spell functions like secret chest, except it affects a small structure, vault, or oversized chest. Living creatures within a secret vault don't cause the spell to fail. While the vault is stored on the Ethereal Plane, living creatures within the vault don't need to eat, drink, or breathe, but they can't leave the vault except via magic such as plane shift. The vault used as a focus for secret vault must cost at least 25,000 gp, and its replica costs 250 gp. A secret vault has only a 1% cumulative chance per day of becoming irretrievably lost after 360 days.","Black Markets"
"Shadow Enchantment","illusion","shadow","shadowUM","bard 3, mesmerist 3, psychic 3, sorcerer/wizard 3","1 standard action","V, S","0","see text","","see text","","see text","0","0","Will disbelief; see text","yes","You use material from the Shadow Plane to cast a quasi-real, illusory version of a psychic, sorcerer, or wizard enchantment spell of 2nd level or lower. Spells that deal damage or have other effects work as normal unless the affected creature succeeds at a Will save. If the disbelieved enchantment spell has a damaging effect, that effect is one-fifth as strong (if applicable) or only 20% likely to occur. If recognized as a shadow enchantment, a damaging spell deals only one-fifth (20%) the normal amount of damage.  If the disbelieved attack has a special effect other than damage, that effect is one-fifth as strong (if applicable) or only 20% likely to occur. Regardless of the result of the save to disbelieve, an affected creature is also allowed any save (or spell resistance) that the spell being simulated allows, but the save DC is set according to shadow enchantment's level (3rd) rather than the spell's normal level. Objects, mindless creatures, and creatures immune to mind-affecting effects automatically succeed at their Will saves against this spell.","Occult Realms"
"Shadow Enchantment, Greater","illusion","shadow","shadowUM","bard 6, mesmerist 6, psychic 6, sorcerer/wizard 6","1 standard action","V, S","0","see text","","see text","","see text","0","0","Will disbelief; see text","yes","This spell functions like shadow enchantment, except that it enables you to create partially real, illusory versions of psychic, sorcerer, or wizard enchantment spells of 5th level or lower. If the spell is recognized as a greater shadow enchantment, it's only three-fifths (60%) as effective.","Occult Realms"
"Detect Fiendish Presence","divination","","","bard 0, cleric/oracle 0, magus 0, sorcerer/wizard 0, witch 0","1 standard action","V, S","0","60 ft.","cone-shaped emanation","","","concentration, up to 10 minutes/level (D)","1","0","none","no","This spell functions like detect evil, except that it detects only outsiders with the evil subtype, as well as the lingering effects caused by their gifts, presence, and spells. It can also detect clerics and paladins of fiendish deities, including Asmodeus, archdevils, daemonic harbingers, and demon lords.","Agents Of Evil"
"Devil Snare","abjuration","","good","cleric/oracle 4, sorcerer/wizard 5","1 full-round action","V, S, M (a pouch of silvered powder worth 25 gp)","1","touch","","10-ft.-radius circle","","1 round/level","0","0","Will negates; see text","yes; see text","Your touch creates an invisible circle on a flat surface. Any outsider passing through this circle must succeed at a Will save or be caught within. Once trapped, a creature must succeed at a Will save as a standard action to physically exit the confines of the circle, teleport, or use any form of extradimensional travel (as per dimensional anchor). Contained outsiders can still attack adjacent creatures outside of the circle, or target others with ranged attacks, spells, and spell-like abilities. Despite the spell's name, devil snare captures outsiders of any type, not only devils.  As a standard action, you can dismiss the circle, expelling any outsiders still trapped within to their planes of origin (as per dismissal). An outsider can resist this effect with a successful Will save, enabling it to remain after the spell is dismissed.","Agents Of Evil"
"Punishing Armor","abjuration","","","alchemist 1, bloodrager 1, magus 1, shaman 1, sorcerer/wizard 1, spiritualist 1, summoner/unchained summoner 1","1 standard action","V, S","0","personal","","","you","10 minutes/level (D)","1","0","Fortitude negates; see below","no","You coat yourself with a thin layer of shimmering energy. Any creature dealing nonlethal damage to you immediately takes half the amount of nonlethal damage dealt. A successful Fortitude save made by the attacking creature negates this damage.","Agents Of Evil"
"Unholy Ward","abjuration","","evil","antipaladin 3, cleric/oracle 4, inquisitor 3, sorcerer/wizard 4","1 standard action","V, S, DF","0","personal","","","you","10 minutes/level (D)","1","0","Fort negates (harmless)","yes (harmless)","This spell grants you resistance to the holy powers of good-aligned deities and their servants. You resist 10 points of damage from holy sources (divine power damage from flame strike, additional damage from smite evil, channeled positive energy, etc.), provided they originate from a good-aligned source or a servant of a good-aligned god. You ignore a maximum of 10 points of damage per caster level, at which point the spell ends.","Agents Of Evil"
"Blood Tentacles","necromancy","","","antipaladin 4, cleric/oracle 5, shaman 5, sorcerer/wizard 5, summoner/unchained summoner 4, witch 5","1 standard action","V, S, M (a fresh handful of the caster's blood)","0","personal","","","you","1 round/level","0","0","Will negates (harmless)","no","You smear a handful of your own blood across your chest, causing one writhing tentacle per caster level to burst forth. You can direct these tentacles to attack a single creature within 15 feet as a standard action, or one creature per 5 caster levels as a full-round action. Each tentacle has an attack bonus equal to your base attack bonus plus either your Constitution or Charisma bonus (whichever is higher). Each tentacle deals 2d6 points of damage, and a tentacle collapses into dried blood on a successful hit, granting you a number of temporary hit points equal to the damage dealt. You can't gain more temporary hit points than your maximum number of hit points. These temporary hit points disappear after 1 hour.","Agents Of Evil"
"Caustic Safeguard","abjuration","","acid","alchemist 3, bloodrager 3, magus 3, sorcerer/wizard 4","1 round","V, S, M (a thin metal wire and a vial of acid)","0","touch","","","object touched","1 hour/level (D)","1","0","Reflex half (see text)","no","You imbue a single object with an acidic protective ward. Any creature other than you that touches the object takes 1d6 points of acid damage per 2 caster levels (maximum 10d6; Reflex half). Each time the spell discharges, the number of damage dice it deals is halved (rounded down); when the spell's damage dice reach 0, the spell ends. While casting this spell, you can touch up to one creature per 4 caster levels, which allows them to handle the warded object without triggering this spell.","Agents Of Evil"
"Coward's Cowl","enchantment","","mind-affecting","alchemist 1, bard 1, cleric/oracle 1, mesmerist 1, psychic 1, shaman 1, sorcerer/wizard 1, witch 1","1 standard action","V, S","0","close (25 ft. + 5 ft./2 levels)","","","one creature","1 minute/level","0","0","Will negates (harmless)","no","You imbue the target with a compulsion to avoid threats, enhancing its defensive instincts. So long as the affected creature  does not move closer to enemies during its turn, or moves at least 5 feet away from adjacent enemies, it gains a +1 morale bonus to its AC, and a +1 morale bonus on saves and on attack rolls made as readied actions and attacks of opportunity. Alternatively, if the affected creature does not close with its enemies, it can increase the DC of all spells it casts as part of a readied action by 1. If the subject of the spell willingly moves toward a threatening creature, the spell immediately ends.  While affected by coward's cowl, a creature takes a -2 penalty on all saving throws against fear effects.","Agents Of Evil"
