"name","school","subschool","descriptor","spell_level","casting_time","components","costly_components","range","area","effect","targets","duration","dismissible","shapeable","saving_throw","spell_resistance","description","source"
"Harrowing","divination","","","bard 3, sorcerer/wizard 3, witch 3","10 minutes","V, S, F (a Harrow deck)","0","touch","","","one creature","1 day/level or until fulfilled","0","0","","","You use a Harrow deck to tell a fortune for yourself or someone else. If you cast harrowing on another creature, you must remain adjacent to the target for the duration of the casting time. A harrowing must describe one set of events or course of action (for example, ""hunting down the pirate king,"" or ""traveling to Viperwall to search for a magic sword"") that the target of the spell intends to undertake at some point during the spell's duration. If you have access to a Harrow deck, draw nine cards when this spell is cast. If you do not have a Harrow deck, you can simulate the draws by rolling a d6 and a d10 for each of the nine cards, as detailed on page 293 of this book. Record the ability score and alignment associated with each card. Each of these cards grants a luck bonus or a penalty on a specific type of d20 check; the magnitude of the penalty or bonus depends upon how closely that particular card's alignment matches the target creature's alignment. If the card and target's alignments are identical, that card provides a +2 luck bonus on the associated suit's check. If the card and target's alignments are of the opposite alignment (see below), the card inflicts a -1 penalty on that associated check. If the card has any other alignment, it provides a +1 luck bonus on the associated suit's check. While penalties persist on all associated checks for as long as the harrowing persists, the bonuses are one-use bonuses that the harrowed character can ""spend"" at any time to modify that card's associated check. You can spend a bonus to modify an appropriate roll after the die is rolled, but cannot spend the bonus once you know the result of the roll. Since all of the bonuses granted by a harrowing are luck bonuses, they do not stack with each other. Penalties, on the other hand, do stack. Once you spend all of the bonuses granted by a harrowing, or once the spell's duration ends, the spell ends and the penalties are removed. A single creature can only be under the effects of one harrowing at a time. If it is subjected to a second harrowing while a previous harrowing is still in effect, the new harrowing automatically fails. Associated Suit Checks Suit Associated Check Hammer (Str) Attack rolls (ranged and melee) Key (Dex) Reflex saving throws Shield (Con) Fortitude saving throws Book (Int) Skill checks Star (Wis) Will saving throws Crown (Cha) Any d20 roll Opposition Alignments Alignment Opposition LG CE NG NE CG LE LN CN N LG, LE, CG, or CE (pick one when spell is cast) CN LN LE CG NE NG CE LG","Inner Sea World Guide"
"Infernal Healing","conjuration","healing","evil","cleric/oracle 1, magus 1, sorcerer/wizard 1, summoner/unchained summoner 1, witch 1","1 round","V, S, M (1 drop of devil blood or 1 dose of unholy water)","0","touch","","","creature touched","1 minute","0","0","Will negates (harmless)","yes (harmless)","You anoint a wounded creature with devil's blood or unholy water, giving it fast healing 1. This ability cannot repair damage caused by silver weapons, good-aligned weapons, or spells or effects with the good descriptor. The target detects as an evil creature for the duration of the spell and can sense the evil of the magic, though this has no long-term effect on the target's alignment.","Inner Sea World Guide"
"Infernal Healing, Greater","conjuration","healing","evil","cleric/oracle 4, magus 4, sorcerer/wizard 4, summoner/unchained summoner 4, witch 4","1 round","V, S, M (1 drop of devil blood or 1 dose of unholy water)","0","touch","","","creature touched","1 minute","0","0","Will negates (harmless)","yes (harmless)","As infernal healing, except the target gains fast healing 4 and the target detects as an evil cleric.","Inner Sea World Guide"
"Lover's Vengeance","enchantment","compulsion","mind-affecting","bard 3, cleric/oracle 3, sorcerer/wizard 3, witch 3","1 minute","V, M (a piece of jewelry worth at least 100 gp)","1","touch","","","creature touched","up to 1 day/level (D) or until discharged","1","0","Will negates (harmless)","Yes (harmless)","You inspire yourself or a lover to a vengeful rage against a chosen enemy, who must be a creature that has wronged you in some way. If cast on you, the next time you are in combat with that enemy, you gain the benefits of a rage spell. If cast on a lover, he or she gains the benefits of a rage spell the next time the lover is in combat against your enemy. This variant of the spell must be cast within 1 hour of an intimate encounter with the target. The rage effect lasts 1 round per level. If the creature that triggers the rage effect is one of your lovers or ex-lovers, the benefits granted by the rage spell double. This spell counts as a contingency spell on the target for the purpose of multiple contingent effects. Worshipers of Calistria are fond of using this spell, and many keep the effect running whenever possible.","Inner Sea World Guide"
"Shield Of The Dawnflower","evocation","","fire, good, light","bard 4, cleric/oracle 4, magus 4, paladin 4, ranger 4","1 standard action","V, S, DF","0","personal","","","you","1 round/level","0","0","see text","no","You create a disk of sunlight on one arm. Any creature that strikes you with a melee attack deals normal damage, but also takes 1d6 points of fire damage + 1 point per caster level (maximum +15). Creatures with reach weapons are not subject to this damage if they attack you. The shield provides illumination as if it were a continual flame spell. You can only have one instance of this spell in effect at a time. It does not stack with similar damaging aura spells such as fire shield.","Inner Sea World Guide"
"Teleport Trap","abjuration","","","sorcerer/wizard 7","10 minutes","V, S, M (powdered lodestone and silver worth 100 gp per 40-ft. cube)","1","medium (100 ft. + 10 ft./level)","one 40-ft. cube/level (S)","","","1 day/level","0","1","Will negates","yes","Teleport trap wards an area, redirecting all teleportation into or out of the area to a specific point within the area determined by you at the time of casting. The destination must be an open space on a solid surface. The spell's area overlaps walls and other solid and liquid objects (preventing intruders from bypassing the ward by teleporting into a wall or through similar means). A teleporting creature that is affected by a teleport trap can resist the effect with a Will save-if the save is successful, the creature simply doesn't teleport at all (but the use of the teleport effect is still consumed)-either to the intended location or the teleport trap's actual destination. A DC 27 Knowledge (arcana) allows such a creature to recognize the teleport trap's presence, but does not reveal the trap's linked destination.  At your discretion, the teleport trap can exclude a category of creatures, such as an alignment, a type of creature, or creatures that carry a specific item or know a password (though this only works if the creature is teleporting out of the area, not into it). You select this option and the conditions at the time you cast the spell. Overly complicated conditions may cause the spell to fail entirely. Multiple castings of teleport trap can be linked to cover a larger area, allowing teleported creatures to be directed to a single point within the combined area of the spells.  Teleport trap can be made permanent at the cost of 7,000 gp. A single permanency spell can be used on all teleport traps that share a linked destination, but the gold piece cost must be paid for each individual spell.  The Pathfinders of the Grand Lodge make use of permanent teleport traps in several key locations, trapping would-be intruders in a small wing of jail cells. At least one crypt of the Whispering Tyrant makes use of the spell as well, trapping grave robbers in coffin-sized stone cysts, there to die a slow and agonizing death from thirst and starvation.","Inner Sea World Guide"
"Unbreakable Heart","enchantment","compulsion","mind-affecting","bard 1, cleric/oracle 1, paladin 1, ranger 1, witch 1","1 standard action","V, S","0","close (25 ft. + 5 ft./2 levels)","","1 creature","","1 round/level","0","0","Will negates (harmless)","yes (harmless)","The target creature gains a +4 morale bonus on saving throws against mind-affecting effects that rely on negative emotions (such as crushing despair, rage, or fear effects) or that would force him to harm an ally (such as confusion). If the target is already under such an effect when receiving this spell, that effect is suppressed for the duration of this spell. It does not affect mind-affecting effects based on positive emotions (such as good hope or the inspire courage bard ability). A creature can still be charmed or otherwise magically controlled while under this spell's effects, but if such a creature ever receives a new saving throw against that effect as a result of being ordered to attempt to harm or otherwise oppose a true ally, he can roll that saving throw twice and take the better result as his actual roll. Calm emotions counters and dispels unbreakable heart.","Inner Sea World Guide"
"Vision of Lamashtu","illusion","phantasm","mind-affecting, evil","cleric/oracle 7, inquisitor 6, witch 7","10 minutes (see text)","V, S","0","unlimited","","","one living creature","instantaneous","0","0","Will negates (see text)","yes","This spell functions exactly as the spell nightmare. In addition to the effects of that spell, you can cause a second spell to be delivered when the target wakes at the nightmare's conclusion.  You must have this second spell prepared, and it must be cast immediately after vision of Lamashtu (effectively adding the two spells' casting times). This second spell ""rides along"" with the nightmare, affecting the target as soon as it wakes from its fitful sleep. Any spell can be sent along with the nightmare, so long as it is of 6th level or lower, affects one target (which is always the nightmare's recipient), and does not deal hit point damage. The second spell's range is irrelevant for the purposes of vision of Lamashtu, and even touch attacks can be delivered in this manner (you must still make a successful touch attack in order to affect the target, though, with the act of touching occurring within the context of the victim's nightmare). The target is allowed to save against the second spell if a save is allowed. For example, a cleric of Lamashtu could send bestow curse along as part of a vision of Lamashtu, but not blade barrier (affects an area), destruction (too high level), or inflict moderate wounds (deals hit point damage).","Inner Sea World Guide"
"Trail of the Rose","illusion","phantasm","","bard 2, cleric/oracle 2","1 standard action","S, V","0","touch","","","1 rose touched","1 hour/level (D)","1","0","no","no","This spell creates an illusory trail in the form of a misty and visible scent coming from the rose used as this spell's material component. When you cast this spell, the scent of the rose leaves a faint pink-tinged illusion that ripples and flows in the area. Only you and up to six creatures you designate upon casting the spell can see the illusion. To designate a creature, you must know it well. It is not enough simply to have met that creature once or heard of the creature.  When you move, this illusory scent leaves a trail, though there are no telltale signs of which direction you moved if creatures designated by this spell find a middle section of the trail. This is typically used to create backtracking method for the caster's handpicked allies, useful for navigating in and out of mazes or labyrinthine cave complexes without leaving behind an obvious trail.","Faiths Of Purity"
"Acidic Spray","conjuration","creation","acid","magus 5, sorcerer/wizard 5","1 standard action","V, S, M (a vial of acid worth 10 gp)","1","60 ft.","","60-ft. line","","instantaneous","0","0","Reflex partial (see text)","yes","A spray of acid erupts from your outstretched hand, dealing 1d6 points of acid damage per caster level (maximum 15d6) to each creature within its area (Reflex half ). This acid continues to burn for 1 round, dealing 1d6 points of acid damage per two caster levels (maximum 7d6) to any creature that failed its saving throw against the spell (a second Reflex save on the creature's turn negates this additional damage).","Ultimate Magic"
"Acute Senses","transmutation","","","alchemist 2, bard 2, inquisitor 2, ranger 2, psychic 2","1 standard action","V, S, M (a glass lens)","0","touch","","","creature touched","1 minute/level","0","0","Will negates (harmless)","yes","The target gains a +10 enhancement bonus on Perception checks. The bonus increases to +20 at caster level 8th, and +30 (the maximum) at caster level 16th.","Ultimate Magic"
"Age Resistance, Lesser","transmutation","","","alchemist 3, druid 4, sorcerer/wizard 4, witch 4, occultist 3, psychic 4","1 standard action","V, S","0","personal","","","you","24 hours","0","0","","","You ignore the physical detriments of being middle-aged. This spell does not cause you to look younger, nor does it prevent you from dying of old age, but as long as the spell is in effect, you ignore the -1 penalties to Strength, Dexterity, and Constitution that accrue once you become middle-aged. You retain the agerelated bonuses to Intelligence, Wisdom, and Charisma while under the effects of this spell. Additional penalties that you accrue upon becoming old or venerable apply in full.","Ultimate Magic"
"Age Resistance, Greater","transmutation","","","alchemist 5, druid 7, sorcerer/wizard 7, witch 7, occultist 5, psychic 7","1 standard action","V, S","0","personal","","","you","24 hours","0","0","","","This spell functions as lesser age resistance, except you ignore all Strength, Dexterity, and Constitution penalties gained from middle age, old age, and venerable age.","Ultimate Magic"
"Age Resistance","transmutation","","","alchemist 4, druid 6, sorcerer/wizard 6, witch 6, occultist 4, psychic 6","1 standard action","V, S","0","personal","","","you","24 hours","0","0","","","This spell functions as lesser age resistance, except you ignore the Strength, Dexterity, and Constitution penalties gained at middle age and old age.","Ultimate Magic"
"Allegro","transmutation","","","bard 2","1 standard action","V","0","personal","","","you","1 round/level (D) or until discharged","1","0","","","This spell allows you to act more swiftly while maintaining a bardic performance. You must already be maintaining a bardic performance before you can cast allegro. You gain the benefits of the spell haste for as long as you maintain that bardic performance. If you cease maintaining the bardic performance or it is interrupted, this spell's duration ends. As an immediate action while you are maintaining a bardic performance, you can dismiss allegro to reroll a Reflex save or Dexterity-based skill check-you must choose to reroll before the result of the original roll is known. You must take the result of the reroll, even if it's worse than the original roll. Allegro dispels and is dispelled by slow.","Ultimate Magic"
"Animate Dead, Lesser","necromancy","","evil","cleric/oracle 2, sorcerer/wizard 3, shaman 2, occultist 2, spiritualist 2","1 standard action","V, S, M (an onyx gem worth at least 25 gp per Hit Die of the undead)","1","touch","","","one corpse","instantaneous","0","0","none","no","This spell functions as animate dead, except you can only create a single Small or Medium skeleton or zombie. You cannot create variant skeletons or zombies with this spell.","Ultimate Magic"
"Anthropomorphic Animal","transmutation","polymorph","","druid 3, sorcerer/wizard 3, witch 3","1 standard action","V, S, M (a humanoid thumb bone)","0","touch","","","animal touched","1 hour/level","0","0","Fortitude negates","yes","You transform the touched animal into a bipedal hybrid of its original form with a humanoid form, similar to how a lycanthrope's hybrid form is a mix of a humanoid and animal form. The animal's size, type, and ability scores do not change. It loses its natural attacks except for bite (if it had one as an animal), all types of movement other than its land speed, and special attacks that rely on its natural attacks. One pair of its limbs is able to manipulate objects and weapons as well as human hands do; limbless animals like snakes temporarily grow a pair of arms. The creature's Intelligence increases to 3, and it gains the ability to speak one language you know. It is not considered proficient in any manufactured weapons. It can attack with unarmed strikes, dealing unarmed strike damage for a creature of its size (unless it has a bite attack, which is a natural attack).  Anthropomorphic animal can be made permanent with a permanency spell cast by a caster of 11th level or higher at a cost of 7,500 gp.","Ultimate Magic"
"Anticipate Peril","divination","","","alchemist 1, bard 1, ranger 1, sorcerer/wizard 1, occultist 1, psychic 1, mesmerist 1, spiritualist 1, medium 1","1 standard action","V, S","0","touch","","","creature touched","1 minute/level or until activated","0","0","Will negates","yes","A creature affected by anticipate peril gains a preternatural sense of danger. The first time during this spell's duration that the target has to make an initiative check, the creature adds an insight bonus on that initiative check equal to the spell's caster level (maximum +5). Once this bonus applies, the effects of the spell end.","Ultimate Magic"
"Arboreal Hammer","transmutation","","","druid 4","1 standard action","V, S, DF","0","medium (100 ft. + 10 ft./level)","","","one Huge or larger tree","1 round/level (D)","1","0","none","no","This spell animates a tree's branch and directs it against your foes. At caster level 10th or lower, you can target a Huge tree. At caster level 11th-15th, you can target a Gargantuan tree, and at caster level 16th or higher you can target a Colossal tree. The animated branch makes slam attacks with a Strength score equal to 10 + your caster level. The branch strikes once per round with an attack bonus equal to your caster level + the branch's Strength modifier, adjusted by the appropriate size modifier (-2 for Huge, -4 for Gargantuan, -8 for Colossal). A Huge tree's slam deals 2d6 points of damage, a Gargantuan tree's slam deals 3d6 points of damage, and a Colossal tree's slam deals 4d6 points of damage; the tree adds 1-1/2 times its Strength modifier to this damage. A Huge tree has reach 15 feet, a Gargantuan has reach 20 feet, and a Colossal has reach 30 feet. The tree attacks the creature you designate when you cast the spell, and is unable to move. You can direct the tree against a new target as a move action. The tree does not gain a bonus for flanking, nor can it help another combatant flank. It cannot attack a foe you cannot see.","Ultimate Magic"
"Arcana Theft","abjuration","","","magus 4, psychic 5","1 standard action","V, S","0","touch","","","creature touched","instantaneous","0","0","none","yes","This spell functions as a targeted dispel magic spell, except it only affects creatures and it requires a melee touch attack. If the melee touch attack is successful and the spell successfully dispels one spell affecting the target, that spell is instead transferred to you, treating you as the original target. You do not receive a new saving throw or spell resistance check against this spell and must accept its affects even if they are not beneficial. This does not alter the spell's duration; for example, if the spell only has 4 rounds of duration remaining when it is stolen, it only affects you for 4 rounds. If the spell or effect has a duration of permanent, its duration continues for 1 hour per caster level of the original caster, after which it ends. The stolen spell does not revert to the original target.","Ultimate Magic"
"Archon's Aura","evocation","","good, lawful","cleric/oracle 3, paladin 3","1 standard action","V, S","0","20 ft.","20-ft. radius centered on you","","","1 minute/level","0","0","Will negates","yes","You gain a powerful aura, similar to an archon's aura of menace.  Any hostile creature within a 20-foot radius of you must make a Will save to resist the effects of this aura. If the creature fails, it takes a -2 penalty on attack rolls and saving throws and to Armor Class for the duration of this spell, or until it successfully hits you with an attack. A creature that has resisted or broken the cannot be affected again by this particular casting of archon's aura.","Ultimate Magic"
"Arrow of Law","evocation","","lawful","cleric/oracle 2, paladin 2","1 standard action","V, S, DF (a holy symbol)","0","close (25 ft. + 5 ft./2 levels)","","arrow-shaped projectile of lawful energy","","instantaneous (1 round); see text","0","0","Will partial (see text)","yes","You fire a shimmering arrow of pure order from your holy symbol at any one target in range as a ranged touch attack.  A chaotic creature struck by an arrow of law takes 1d8 points of damage per two caster levels (maximum 5d8). A chaotic outsider instead takes 1d6 points of damage per caster level (maximum 10d6) and is dazed for 1 round. A successful Will save reduces the damage to half and negates the daze effect.  This spell deals only half damage to creatures that are neither chaotic nor lawful, and they are not dazed. The arrow has no effect on lawful creatures.","Ultimate Magic"
"Ash Storm","conjuration","creation","fire","druid 3, sorcerer/wizard 3, witch 3","1 standard action","V, S, M/DF (a pinch of ash)","0","long (400 ft. + 40 ft./level)","cylinder (40-ft. radius, 20 ft. high)","","","1 round/level","0","0","none","no","Driving ash blocks all sight (even darkvision) within the spell's area of effect, and falling cinders cause the ground in the area to become difficult terrain.","Ultimate Magic"
"Astral Projection, Lesser","necromancy","","","cleric/oracle 5, sorcerer/wizard 5, psychic 5","30 minutes","V, S, M (1,000 gp jacinth)","1","touch","","","you plus one additional willing creature touched per two caster levels","see text","0","0","none","yes","This spell functions as astral projection, except you cannot leave the Astral Plane and explore other planes (though you can still return to the plane you were on when you cast this spell).","Ultimate Magic"
"Atavism","transmutation","","","druid 4","1 standard action","V, S","0","close (25 ft. + 5 ft./2 levels)","","","one animal","1 minute/level","0","0","Fortitude negates","yes","By bringing forth the primeval ancestry of the target animal, you awaken a savage engine of destruction. The animal immediately gains the advanced creature simple template.  It gains a +2 bonus on all rolls, including damage rolls and special ability DCs, a +4 bonus to AC and CMD, and +2 hit points per HD. The animal's primal instincts take hold for the duration of this spell-if the animal knows tricks granted by the Handle Animal skill, it loses access to all of those tricks save for ""attack."" This spell has no effect on animals that already have the advanced creature template.","Ultimate Magic"
"Atavism, Mass","transmutation","","","druid 8","1 standard action","V, S","0","close (25 ft. + 5 ft./2 levels)","","","one animal/level, no two of which can be more than 30 ft. apart","1 minute/level","0","0","Fortitude negates","yes","This spell functions as atavism, except it affects multiple creatures.","Ultimate Magic"
"Aura of Doom","necromancy","","emotion, fear, mind-affecting","cleric/oracle 4, psychic 4, spiritualist 4","1 standard action","V, S, M/DF (powdered bone)","0","personal","20-ft.-radius emanation centered on you","","","10 minute/level","0","0","Will negates","yes","You emanate an almost palpable aura of horror. All non-allies within this spell's area, or that later enter the area, must make a Will save to avoid becoming shaken. A successful save suppresses the effect. Creatures that leave the area and come back must save again to avoid being affected by the effect.","Ultimate Magic"
"Badger's Ferocity","transmutation","","","cleric/oracle 3, druid 3, ranger 2, sorcerer/wizard 2, occultist 2","1 standard action","V, S","0","close (25 ft. + 5 ft./2 levels)","","","one weapon/3 levels","concentration","0","0","Will negates (harmless)","yes (harmless)","This functions like keen edge, except it affects multiple weapons and requires your concentration. You select the weapons to be affected, and can only affect one weapon per creature. If a creature's weapon exceeds the spell's range, the spell ends for that weapon.","Ultimate Magic"
