"name","school","subschool","descriptor","spell_level","casting_time","components","costly_components","range","area","effect","targets","duration","dismissible","shapeable","saving_throw","spell_resistance","description","source"
"Forbid Action","enchantment","compulsion","language-dependent, mind-affecting","cleric/oracle 1, inquisitor 1, occultist 1, psychic 1, mesmerist 1","1 standard action","V","0","close (25 ft. +5 ft./2 levels)","","","one creature","1 round","0","0","Will negates","yes","You forbid the target a single course of action, which it avoids to the best of its ability. You may demand the target not take actions that fall into one of the following options. Attack: The target cannot take any action that involves an attack roll, or uses a spell or ability that targets a foe or an area that includes a foe. Cast: Target cannot cast spells or use spell-like abilities. Communicate: The target cannot take any actions that allow it to communicate with anyone. This includes such acts as speaking, Bluff checks to pass secret messages, writing, and using telepathy. It does not prevent verbalizations made for purposes other than communication, such as command words or the verbal component of spellcasting. Draw: Target cannot ready or prepare any item, weapon, component, or equipment. Move: The target can take no act that would cause it to end up in a different location. The target does not resist being moved by others (and thus can be picked up or dragged, or can float along on a raft), but does not consciously attempt to move (including not directing a mount to move). The target is free to take any actions not forbidden by the caster. For example, a target affected by this spell's demand to not move is still free to cast spells, make attacks, or shout for help.","Ultimate Magic"
"Forbid Action, Greater","enchantment","compulsion","language-dependent, mind-affecting","cleric/oracle 5, inquisitor 5, occultist 5, psychic 5, mesmerist 4","1 standard action","V","0","close (25 ft. +5 ft./2 levels)","","","one creature/level, no two of which can be more than 30 ft. apart","1 round/level","0","0","Will negates","yes","This spell functions as forbid action, except up to one creature per level may be affected. Each creature must receive the same forbidden action.","Ultimate Magic"
"Force Hook Charge","evocation","","force","magus 3, bloodrager 3, psychic 4","1 standard action","V, S","0","close (25 feet + 5 feet/2 levels)","","","one creature or object within range and you","instantaneous","0","0","none","yes","You create a hook of force that strikes the target and drags you to a space adjacent to it. Make a ranged touch attack against the target; if the touch attack succeeds, the target takes 1 point of force damage per caster level. Whether or not the touch attack hits, the force hook drags you in a straight line to a square adjacent to the target. This movement provokes attacks of opportunity as normal. The pulling hook keeps you from falling as part of this movement; therefore you can use it to cross a pit or chasm, or reach a higher or lower elevation. If the line of effect from you to the target passes through an area that is too small to fit your body (such as a portcullis or arrow slit), the hook pulls you to that location and you take damage as if you had fallen the distance from your starting point to that location. If you are restrained, such as being chained to a wall, the hook pulls you to the maximum extent of your restraints but does not break the restraints.  If your travel to the destination is not blocked, you land on your feet, unharmed by the sudden motion. However, the spell does not guarantee you a safe landing space when you arrive. For example, if your target is flying or on a ledge with no room for you to stand, once the hook pulls you adjacent to the target, you begin to fall.  If you use this spell with your spell combat class ability, you can make your melee attack from your starting position or your ending position.","Ultimate Magic"
"Force Punch","evocation","","force","magus 3, sorcerer/wizard 3, bloodrager 3, psychic 3, spiritualist 3","1 standard action","V, S","0","touch","","","creature touched","instantaneous","0","0","Fortitude partial","yes","This spell charges your hand with telekinetic force. Your successful melee touch attack deals 1d4 points of force damage per level (maximum 10d4) and causes the target to be pushed away from you in a straight line up to 5 feet per two caster levels. For every size category of the target above Medium, reduce the distance pushed by 5 feet (-5 feet for Large, -10 feet for Huge, -15 for Gargantuan, and -20 feet for Colossal) to a minimum of 0 feet. A successful Fortitude save negates the movement but not the damage.","Ultimate Magic"
"Forced Quiet","transmutation","","sonic","bard 1, inquisitor 1, sorcerer/wizard 1, witch 1, psychic 1, mesmerist 1","1 standard action","S","0","medium (100 ft. + 10 ft./level)","","","one creature","1 round/level","0","0","Will negates","yes","With a gesture, you muffle sound around the target, making it unable to yell or otherwise make loud noises. This does not affect spellcasting by the target. The target can still use sonic effects, but the DC of these effects decreases by 2. The target gains a +2 bonus on saving throws against sonic effects. The target gains a +4 circumstance bonus on Stealth checks.","Ultimate Magic"
"Frigid Touch","evocation","","cold","druid 2, magus 2, sorcerer/wizard 2, bloodrager 2","1 standard action","V, S","0","touch","","","creature touched","instantaneous","0","0","none","yes","This spell causes your hand to glow with a pale blue radiance. Your melee touch attack deals 4d6 points of cold damage and causes the target to be staggered for 1 round.  If the attack is a critical hit, the target is staggered for 1 minute instead.","Ultimate Magic"
"Frostbite","transmutation","","cold","druid 1, magus 1, witch 1, bloodrager 1, shaman 1","1 standard action","V, S","0","touch","","","creature touched","instantaneous","0","0","none","yes","Your melee touch attack deals 1d6 points of nonlethal cold damage + 1 point per level, and the target is fatigued. The fatigued condition ends when the target recovers from the nonlethal damage. This spell cannot make a creature exhausted even if it is already fatigued. You can use this melee touch attack up to one time per level.","Ultimate Magic"
"Fumbletongue","enchantment","compulsion","mind-affecting","bard 1, witch 1, psychic 1, mesmerist 1","1 standard action","V, S","0","close (25 ft. +5 ft./2 levels)","","","one creature","1d4 rounds","0","0","Will negates","yes","This enchantment causes a creature to be unable to speak intelligibly. Any effort the target makes to talk, in any language, comes out as a useless mix of unconnected words and noises. Even magic words are affected to some extent; the target has a 20% spell failure chance for any spell it attempts to cast with verbal components, and a 20% chance to incorrectly use a command word to activate a magic item.  This spell has no effect on telepathic communication, or the vocalizations of creatures that lack a spoken language.","Ultimate Magic"
"Fungal Infestation","necromancy","","disease","druid 3","1 standard action","V, S","0","touch","","","creature touched","1d3 days","0","0","Fortitude negates","yes","You coat the target in necrotic fungus that makes its flesh soft and fragile. Toadstools, ringworm, and other disgusting fungal growths sprout from its skin. The target takes 1d3 points of Charisma damage. Any physical attack against the target automatically adds 1d6 points of bleed damage.","Ultimate Magic"
"Ghostly Disguise","illusion","glamer","","alchemist 2, bard 2, inquisitor 2, sorcerer/wizard 2, witch 2, occultist 2, psychic 2, mesmerist 2, medium 2","1 standard action","V, S","0","personal","","","you","10 minute/level (D)","1","0","","","You make yourself-including clothing, armor, weapons, and equipment-appear translucent like a ghost. Any mundane or magical disguise on you is affected by this illusion as well; for example, if you are disguised as the king or a sahuagin, you look like a ghostly version of the king or a sahuagin. Your ghostly form may have a pale green, blue, or violet coloration, or a muted version of your normal appearance.  The spell does not actually make you ghostly or provide any incorporeal abilities. If you choose, the illusion can make you appear to float slightly above the ground, though you are actually still on the ground. A creature that interacts with the glamer gets a Will save to recognize it as an illusion.","Ultimate Magic"
"Haunting Choir","necromancy","","mind-affecting, pain","bard 3, mesmerist 3","1 standard action","V, S","0","close (25 ft. + 5 ft./2 levels)","30-ft.-radius emanation","","","concentration + 2 rounds","0","0","Will negates","yes","You create a spectral choir and conduct its tortured, ghostly moans, deluding listeners into believing they are suffering the torments of the dead.  The transparent singers occupy a 10-foot cube, but they are intangible and do not interfere with creatures in any physical way, nor can they be attacked.  Creatures within 30 feet of the choir experience wracking pain that causes them to take a -2 penalty on attack rolls, skill checks, and ability checks.  Individuals who exit the area of effect take these penalties for an additional 2 rounds before the delusion wears off.","Ultimate Magic"
"Haunting Mists","illusion","figment","fear, shadow","bard 2, sorcerer/wizard 2, witch 2, psychic 2, mesmerist 2","1 standard action","V, S","0","20 ft.","","cloud spreads in 20-ft. radius, 20 ft. high","","1 minute/level (D)","1","0","Will partial (see text)","no","An illusion of misty vapor inhabited by shadowy shapes arises around you. It is stationary. The illusory mist obscures all sight, including darkvision, beyond 5 feet. A creature 5 feet away has concealment (attacks have a 20% miss chance).  Creatures farther away have total concealment (50% miss chance, and the attacker cannot use sight to locate the target).  All creatures within the mist must save or take 1d2 points of Wisdom damage and gain the shaken condition. The shaken condition lasts as long as the creature remains in the mist.","Ultimate Magic"
"Hex Ward","abjuration","","","inquisitor 1, witch 1, shaman 1, occultist 1","1 standard action","V, S","0","touch","","","creature touched","1 hour/level","0","0","Will negates (harmless)","yes (harmless)","You give the target a +4 resistance bonus on saving throws against witch hexes.","Ultimate Magic"
"Holy Ice","transmutation","","cold, good, water","cleric/oracle 5","1 standard action","V, S, M (a flask of holy water or 5 pounds of powdered silver worth 25 gp)","1","medium (100 ft. + 10 ft./level)","","wall of ice or flying ice javelins (see text)","","1 minute/level, instantaneous, or until expended (see text)","0","0","Reflex negates or none (see text)","yes","This spell creates a large mass of frozen holy water that can be used for one of two effects.  Holy Ice Wall: This functions like wall of ice (hemisphere or plane). Any creature that takes damage from holy water takes 1 point of damage every time it touches or attacks the ice wall with melee attacks; extended contact with the wall (such as standing or walking on it) deals 1d6 points of damage. Even when the ice has been broken through, a sheet of frigid holy air remains. Any creature that steps through it (including the one who broke through the wall) takes 1d6 points of damage + 1 point per caster level (no save); half of this damage is cold damage, half is damage from holy water (creatures unharmed by holy water do not take the damage).  Holy Ice Javelins: The spell creates a number of javelins of frozen holy water in your square equal to your caster level (maximum 15), which hurl themselves toward one or more targets that are no more than 10 feet away from each other.  You must succeed on attack rolls (one per javelin) to hit the target with the javelin, using your base attack bonus + your Wisdom modifier. The javelins deal 1d6 damage each, plus 1 point of cold damage and 1 point of damage from holy water.  The javelins are destroyed by this attack.","Ultimate Magic"
"Holy Shield","abjuration","","","paladin 2","1 standard action","V, S","0","personal","","","you","10 minutes/level","0","0","none","no","You gain the ability to magically project the defense of your shield to protect another creature at a distance. As a swift action, you designate one target within 30 feet. The target gains your shield's shield bonus and enhancement bonus to Armor Class until your next turn; you gain no benefit from the shield's shield bonus or enhancement bonus while using this spell and cannot use any of the shield's other properties or abilities (such as magical abilities, making a shield bash, or providing cover with a tower shield). As a swift action, you may move the protection to another target (including yourself); if you move the protection to yourself, you may use any of the shield's properties or abilities as normal. If the shielded creature exceeds the 30-foot range, your shield's protection automatically reverts to you. Any circumstance that would make you lose your shield bonus (such as an enemy breaking the shield, you dropping the shield, or you becoming helpless or unconscious) means the protected creature loses the shield's benefit.","Ultimate Magic"
"Horn of Pursuit","evocation","","sonic","bard 1, inquisitor 1, paladin 1, ranger 1","1 standard action","S","0","personal","","3 peals of a horn","","1 round","0","0","none","no","You create the sound of a large hunting horn, blowing up to three notes as loud as a roaring dragon. These notes can be heard up to 2 miles away in typical outdoor conditions.  You can make these sounds at any point during the spell's duration as a free action, and each sounding can be short or long, allowing you to send very simple coded messages.","Ultimate Magic"
"Howling Agony","necromancy","","death, pain","inquisitor 2, sorcerer/wizard 3, witch 3, bloodrager 3, psychic 2, mesmerist 2, spiritualist 3","1 standard action","V, S, M (a needle and a dried eyeball)","0","close (25 ft. + 5 ft./2 levels)","","","one living creature/level, no two of which can be more than 30 ft. apart","1 round/level","0","0","Fortitude negates","yes","You send wracking pains through the targets' bodies. Because of the pain, affected creatures take a -2 penalty to AC, attacks, melee damage rolls, and Reflex saving throws, and must succeed at a concentration check (DC equal to the DC of this spell) to cast spells. However, if an affected creature spends a move action screaming as loudly as possible, it can act without any other penalties for the remainder of its turn. ""Screaming,"" for the purposes of this spell, includes any vocalization of pain or its telepathic equivalent; creatures that cannot scream (such as creatures without the natural ability to communicate or vocalize) suffer the full effect of the spell.","Ultimate Magic"
"Ice Body","transmutation","","cold","sorcerer/wizard 7, witch 7, shaman 7","1 standard action","V, S","0","personal","","","you","1 minute/level (D)","1","0","","","Your form transmutes into living ice, granting you several abilities. You gain the cold subtype and damage reduction 5/ magic. You are immune to ability score damage, blindness, critical hits, deafness, disease, drowning, electricity, poison, stunning, and all spells or attacks that affect your physiology or respiration, because you have no physiology or respiration while this spell is in effect. You cannot drink (and thus can't use potions) or play wind instruments.  Your unarmed attack deals damage equal to a club sized for you (1d4 for Small characters or 1d6 for Medium characters) plus 1 point of cold damage, and you are considered armed when making unarmed attacks. You may burrow through nonmagical ice or snow at your base speed as easily as a fish swims through water. You can move through magical ice and snow if you succeed on a caster level check (1d20 + caster level) against a DC of 11 + the caster level of the effect; you automatically succeed on caster level checks against effects that you created. Your passage through snow and ice in this fashion leaves behind no tunnel or hole.","Ultimate Magic"
"Ice Crystal Teleport","conjuration","teleportation","cold","sorcerer/wizard 6, summoner 5, witch 6, unchained summoner 6","1 standard action","V","0","long (400 ft. + 40 ft./level)","","","one creature","1d4 rounds and instantaneous","0","0","Will negates","yes","This spell functions as teleport, except you use it to teleport yourself or one other creature to a safe location you specify (the target can bring along objects as long as their weight doesn't exceed the target's heavy load). You can only send the target to a location with which you are very familiar. The target is first trapped in ice (hardness 0, 3 hit points per inch of thickness, 1 inch thick per caster level) for 1d4 rounds, during which time it is paralyzed, aware but unable to take any physical actions, and begins to fade away as the teleportation aspect takes effect. At the end of the 1d4 rounds, the target teleports to the specified location, and the ice's hit points drop to 0 and it quickly melts away. If the ice is destroyed before the target teleports, the spell ends and the teleport doesn't occur.","Ultimate Magic"
"Icicle Dagger","conjuration","creation","cold","sorcerer/wizard 1, summoner/unchained summoner 1, witch 1, bloodrager 1, occultist 1","1 standard action","V, S","0","0 ft.","","one icicle","","1 minute/level","0","0","none","no","You create a masterwork dagger out of ice. The dagger deals 1 point of cold damage in addition to normal dagger damage.  If the dagger leaves your hand for more than 1 round, it melts and the spell ends. At 6th level, the dagger functions as a +1 frost dagger. At 11th level, it gains the returning property when thrown, melting away and reforming in your hand just before your next turn.","Ultimate Magic"
"Icy Prison","evocation","","cold","sorcerer/wizard 5","1 standard action","V, S","0","medium (10 ft. + 10 ft./level)","","","one creature","1 minute/level; see text","0","0","Reflex partial","yes","You trap the target in solid ice 1 inch thick per caster level. If the creature fails its save, it is helpless, but can still breathe (the ice blocks line of effect to the target). If the target makes its save, it gains the entangled condition but can otherwise act normally. Whether or not the target saves, it takes 1 point of cold damage per caster level each round it is helpless or entangled in the ice. The ice has hardness 0 and 3 hit points per inch of thickness; if broken, the creature is freed. A creature can break the ice as a full-round action with a successful Strength check (DC 15 + your caster level).","Ultimate Magic"
"Icy Prison, Mass","evocation","","cold","sorcerer/wizard 9","1 standard action","V, S","0","medium (10 ft. + 10 ft./level)","","","one creature/level, no two of which can be more than 30 ft. apart.","1 minute/level; see text","0","0","Reflex partial","yes","This spell functions as icy prison, except as noted above.","Ultimate Magic"
"Imbue with Aura","transmutation","","","cleric/oracle 2","1 standard action","V, S, DF","0","close (25 ft. + 5 ft./2 levels)","","","one creature","1 minute/level","0","0","Will negates (see text)","yes","You infuse another creature with your divine aura, causing the target to radiate an aura identical to your own clerical aura. The target's actual alignment is not changed, but spells like detect evil or detect good detect only the aura, not the creature's actual alignment. For the duration of this spell, effects influenced by the target's alignment function according to the imposed aura, not the creature's actual aura. When the spell ends, the target's aura returns to normal, and alignmentaffecting magic affects it according to its actual alignment.","Ultimate Magic"
"Interplanetary Teleport","conjuration","teleportation","","cleric/oracle 9, sorcerer/wizard 9, psychic 9","1 standard action","V","0","personal and touch","","","you and touched objects or other touched willing creatures","instantaneous","0","0","none and Will negates (object)","no and yes (object)","This spell functions as teleport, except there is truly no range limit and you do not need to have seen your destination, though you must have a solid grasp of which world you wish to travel to (""the third planet from the sun"" is an acceptable destination, but ""a habitable world near that bright star"" is not). If you have a specific location on a planet in mind, you arrive there without a chance of failure; otherwise you arrive at a location that would not immediately be life-threatening.  If no such safe landing zone exists on the world, such as someone attempting to travel into the sun without the proper precautions in place, the spell simply fails.","Ultimate Magic"
"Interrogation","necromancy","","evil, pain","inquisitor 1, sorcerer/wizard 1, witch 1, psychic 1, mesmerist 1","1 round","V, S","0","touch","","","living creature touched","1 minute/level","0","0","Fortitude negates","yes","You question the target, backed up by the threat of magical pain. You may ask one question per two caster levels. The target can either answer the question or take 1d4 points of damage plus your Wisdom bonus. The target is not compelled to answer truthfully, but the threat of pain gives it a -4 penalty on Bluff checks to convince you when it is lying.","Ultimate Magic"
"Interrogation, Greater","necromancy","","evil, pain","inquisitor 4, psychic 4","1 round","V, S","0","touch","","","living creature touched","1 minute/level","0","0","Fortitude negates","yes","This spell functions as interrogation, except you may ask one question per caster level and the spell deals damage equal to 1d8 points plus your Wisdom bonus if the target doesn't answer a question.","Ultimate Magic"
"Joyful Rapture","conjuration","healing","emotion","bard 5, cleric/oracle 6, sorcerer/wizard 7, psychic 6, mesmerist 5","1 standard action","V, S","0","60 ft.","all allies and opponents within a 60-ft.-radius burst centered on you","","","instantaneous","0","0","no","yes","Your inspired words overwhelm others with transcendental bliss. All allies within the area of effect are freed from any harmful emotion effects. The spell also cures 1d4 points of Intelligence, Wisdom, or Charisma damage (your choice) to all allies in the area.","Ultimate Magic"
"Ki Arrow","conjuration","","","bard 1, sorcerer/wizard 1, witch 1, psychic 1","1 standard action","S","0","touch","","","1 arrow touched","instantaneous","0","0","Fortitude (object)","yes (object)","You imbue an arrow with your power and throw it at a target up to 100 feet away. Make a ranged attack roll. If it hits, the target takes damage from the arrow as if you had hit it with a single unarmed strike (including your Strength bonus).","Ultimate Magic"
"Ki Leech","necromancy","","evil","cleric/oracle 3, sorcerer/wizard 3, witch 3, psychic 3","1 standard action","V, S","0","personal","","","you","1 minute/level (D)","1","0","","","You place your spirit in a receptive state so when you confirm a critical hit against a living enemy or reduce a living enemy to 0 or fewer hit points, you can steal some of that creature's ki. This replenishes 1 point of ki as long as you have at least 1 ki point in your ki pool. This does not allow you to exceed your ki pool's maximum. This ability does not stack with similar abilities (such as the steal ki ability of the hungry ghost monk in the Advanced Player's Guide).  This spell has no effect if you do not have a ki pool.","Ultimate Magic"
"Ki Shout","evocation","","sonic","bard 5, sorcerer/wizard 7, psychic 7","1 standard action","V, S","0","close (25 ft + 5 ft./2 levels)","","","one living creature","instantaneous","0","0","Fortitude partial (see text)","yes","With a guttural bark, you unleash a sudden blast of sonic energy that strikes your opponent. The target takes 1d6 points of sonic damage per level (maximum 20d6) and is stunned for 1 round; a successful Fortitude save reduces the damage by half and negates the stun.","Ultimate Magic"
"Know The Enemy","divination","","","cleric/oracle 1, inquisitor 1, paladin 1, ranger 1","1 minute","S, V, DF","0","personal","","","you","instantaneous","0","0","none","no","You commune with the divine, reflecting on one type of creature you encountered in the last day. You may make a Knowledge check regarding that creature type with a +10 insight bonus.","Ultimate Magic"
"Leashed Shackles","evocation","","force","inquisitor 4, sorcerer/wizard 6, psychic 6, spiritualist 6","1 standard action","V, S","0","medium (100 ft. +10 ft./level)","","","one creature","1 minute/level","0","0","Reflex negates","yes","You create shackles of force that attach to the target's limbs. You designate an object or location within 30 feet of the target for the shackles to anchor themselves to; this must be the ground, a wall, or a sturdy structure for the anchoring to occur. The target is entangled, and cannot move more than 30 feet from the anchor point of the spell. The shackle itself cannot be attacked (though it can be dispelled), but if the object or area it is attached to is broken, the target is free to move away (though it is still entangled).","Ultimate Magic"
