"name","school","subschool","descriptor","spell_level","casting_time","components","costly_components","range","area","effect","targets","duration","dismissible","shapeable","saving_throw","spell_resistance","description","source"
"Jungle Mind","divination","scrying","","druid 5, oracle 5, ranger 4","1 minute","V, S, DF","0","personal","","","you","10 minutes/level","0","0","Will negates (see text)","no","You merge your mind into the jungle's social hierarchy, mystically establishing yourself as a master of wild beasts and an apex predator. You attain knowledge about the general animal population in a radius of 1 mile as commune with nature, and you then select one type of animal (such as birds, cats, snakes, or fish). For the duration of the spell, you can sense the location, movement, and size of creatures of this type in the area, though you can't discern species or individual identity. In addition, you improve the starting attitude of animals of the chosen type by one step for the duration of the spell.  As a full-round action, you may focus on a single animal that you can sense with this spell to establish a mental link. You can read the animal's surface thoughts as detect thoughts, and can see, hear, and smell what the animal is experiencing using your own Perception skill. If you target another creature's animal companion, the spell ends if the animal succeeds at a Will save. Using this ability reduces the spell's remaining duration to 1 round/level, and the selected animal is treated as the scrying sensor.  Despite the name, jungle mind functions within any terrain.","Faiths & Philosophies"
"Lay Of The Land","divination","","","cleric/oracle 2, bard 2, druid 2, ranger 2, witch 2","1 minute","V, S, M (a piece of soil from the land to be memorized)","0","personal","","","you","1 day","0","0","none","yes","In a flash of recognition, you learn about the geography of your surroundings within a radius of 1 mile per 2 caster levels (minimum 1 mile). This instant familiarity grants you an insight bonus equal to your caster level (maximum +5) on Knowledge (geography) checks and Survival checks to avoid getting lost so long as you remain in the affected area.  Additionally, for the duration of the spell you can make Knowledge (geography) checks regarding the affected area as though you were trained in that skill.","Faiths & Philosophies"
"Source Severance","abjuration","","","cleric/oracle 6, druid 6, witch 6","1 standard action","V, S, M (an unworked lodestone)","0","5 feet","5-ft.-radius emanation, centered on you","","","10 minutes/level (D)","1","0","none","see text","You create an invisible barrier that surrounds you and moves with you, inhibiting one category of magic. When you cast this spell, choose either arcane or divine magic. This spell functions like antimagic field, but it suppresses only spells of the chosen type and supernatural and spell-like class abilities from classes that grant spellcasting of the selected type. Magic items, other spell-like abilities, and other supernatural abilities are unaffected.  While this spell is in effect, you must succeed at a concentration check (DC 20 + twice the spell level) to cast any spell, whether arcane or divine. If you fail at the check, you lose the spell as if you had cast it to no effect.","Faiths & Philosophies"
"Tectonic Communion","divination","","","druid 7","1 hour","V, S, DF","0","personal","","","you","Instantaneous","0","0","","","Tectonic communion functions as commune with nature with an even greater range. In outdoor or natural underground settings, the spell operates on a radius of 100 miles per caster level, extending even underground without penalty.  For every 2 caster levels above 13th, you may glean an additional fact from the list presented in commune with nature. Communities, dungeons, and signs of civilization (such as roads, farms or other constructions and settlements) exist as dark and unknowable blots in your perception of the spell's area; you're aware of their location and existence, but can't discern any information regarding them.","Faiths & Philosophies"
"Anti-Summoning Shield","abjuration","","","bard 2, inquisitor 3, sorcerer/wizard 2, summoner/unchained summoner 2","1 standard action","V","0","medium (100 ft. + 10 ft./level)","50-ft.-radius","","","1 minute/level (D)","1","0","Will negates","yes","Within the area of effect, this spell impedes the use of spells of the summoning subschool and other effects that summon creatures. Any such spells, spell-like abilities, or similar summoning effects used within the area have a percent chance of failure equals 5% x your caster level, to a maximum 75% chance of failure. If the summoning effect already has a percent chance of failure (as is often the case with the summon spell-like ability of outsiders), these percentages stack. This spell does not affect summoners attempting to summon their eidolon, but it does affect summoners casting other summoning spells.","Demon Hunter's Handbook"
"Burst With Light","evocation","","light","cleric/oracle 4, paladin 4","1 standard action","V, S","0","close (25 ft. + 5 ft./2 levels)","","","one creature","1 round/4 levels","0","0","see text","yes","The target becomes filled with intense magical light, taking 2d6 points of damage as the light bursts from its wounds and orifices (if the target is an undead creature, it instead takes 2d8 points of damage). In addition, the creature radiates bright light in a 30-foot radius and increases the light level by one step for an additional 30 feet beyond that area-darkness becomes dim light, dim light becomes normal light, and normal light becomes bright light. Creatures that take penalties in bright light take them while within the 30-foot radius of this magical light. A successful Will save halves the damage and negates the light effect.  For every 4 character levels you possess, the light continues to fill the creature for another round (to a maximum of 5 rounds at 20th level), though the target may make a Will save each round to halve the damage and end the effect. Any creature adjacent to the target that fails its save and takes damage takes half as much damage and is blinded for 1 round. A successful Reflex save halves this damage (to a total of one-quarter the damage taken by the target) and negates the blindness effect.","Demon Hunter's Handbook"
"Detect Demon","divination","","","cleric/oracle 1, inquisitor 1, paladin 1","1 standard action","V, S, DF","0","60 ft.","cone-shaped emanation","","","concentration, up to 10 minutes/level (D)","1","0","none (see text)","no","You sense the presence of a specific kind of evil-that of demons, their servants, and the Abyss. The amount of information revealed depends on how long you study a particular area or subject.  1st Round: Presence or absence of creatures with the demon subtype, creatures possessed by demons, creatures under the effects of spells or spell-like abilities cast by demons, or creatures otherwise tainted by demons. Creatures tainted by demons include tieflings with demonic heritages, sorcerers with abyssal bloodlines, creatures affected by a succubus's profane gift, creatures with demonic implants (see page 44 of Pathfinder Campaign Setting: Lords of Chaos, Book of the Damned, Vol. 2), or creatures who have the Demonic Obedience feat (Lords of Chaos 8), and those under significant demonic influence as determined by the GM. This spell does not detect creatures of chaotic evil alignment who are not demons or significantly influenced by demons.  Additionally, this spell detects whether or not a portal or similar magical passage leads to the Abyss.  2nd Round: Number of evil auras shed by creatures with the demon subtype in the area, as well as the power of the most potent evil aura present. If you are of good alignment, and the strongest evil aura's strength is overwhelming; if the creature has HD equal to at least twice your character level, you are stunned for 1 round and the spell ends.  3rd Round: The power and location of each aura, and what demon lord, if any, a demon is most closely affiliated with. If an aura is outside your line of sight, you discern the direction but not its exact location. Affiliation to a demon lord is only revealed when the creature detected is a demon (not merely a creature tainted by a demon). Demons receive a Will saving throw to resist revealing what demon lord they are affiliated with. If the demon succeeds at this saving throw or is not forsworn to a demon lord, you know only that this aspect of the spell returned no information.  Aside from what is detailed above, this spell otherwise functions similarly to detect evil in terms of aura power, lingering auras, overwhelming auras, and so forth.","Demon Hunter's Handbook"
"Protection From Outsiders","abjuration","","see text","cleric/oracle 2, inquisitor 2, paladin 2","1 standard action","V, S, DF","0","touch","","","creature touched","1 minute/level (D)","1","0","Will negates (harmless)","no; see text","This spell wards a creature from attacks by outsiders with a specific racial subtype, from mental control exerted by creatures of the chosen subtype, and from summoned creatures of that subtype. Only the subtypes of specific outsider races-angel, azata, demon, oni, psychopomp, protean, and so on-can be chosen as the subtype this spell protects against. Alignment subtypes or other general subtypes (like elemental, extraplanar, or native) cannot be selected. Outsiders without an outsider racial subtype (like genies, night hags, yeth hounds, or xills) are not affected by this spell.  This spell creates a magical barrier around the subject at a distance of 1 foot. The barrier moves with the subject and has three major effects.  First, the subject gains a +4 deflection bonus to AC and a +4 resistance bonus on saves when targeted by creatures of the chosen subtype.  Second, the subject immediately receives another saving throw (if one was allowed to begin with) against any spells or effects that possess or exercise mental control over the target creature. This functions in the same fashion as protection from evil, but only when the effect stems from outsiders of the chosen subtype, and the target's saving throw is made with a +4 morale bonus (using the same DC as the original effect).  Third, the spell prevents bodily contact by summoned creatures of the chosen subtype in the same manner as detailed in protection from evil.  This spell's descriptor varies depending on the outsider race selected, gaining the alignment descriptors opposite to the alignment of the outsider race-for example, lawful and good if the race is chaotic and evil, chaotic if the selected race is lawful, or none if the selected race is neutral.","Demon Hunter's Handbook"
"Righteous Blood","abjuration","","good","inquisitor 2, paladin 2","1 standard action","V, S, DF","0","touch","","","one creature of good alignment","10 minutes/level (D)","1","0","Will negates (harmless)","yes (harmless)","The target creature's innate goodness infuses its body with holy energy. While this energy does not directly empower the target, it can harm embodiments of evil. Any creature that damages the target with a slashing or piercing melee weapon is sprayed by the target's holy blood. If the attacker is a creature with the evil subtype, it takes 1d6 points of damage from divine power each time it successfully hits the target. If the target has the good subtype or an ability that grants it an aura of good (like paladins or some clerics), its blood instead deals 2d6 points of damage. Creatures that don't have the evil subtype or that are using reach weapons are not subject to this damage.","Demon Hunter's Handbook"
"Telepathic Censure","abjuration","","","bard 2, inquisitor 2","1 standard action","V","0","medium (100 ft. + 10 ft./level)","","","one creature (see text)","1 minute/level (D)","1","0","Will negates","yes","This spell creates an invisible psychic interference that inhibits telepathic communication. When cast upon a creature that can communicate via telepathy, this spell prevents that ability's use- either to receive or project thoughts. When cast upon a creature without telepathy, the spell merely prevents the target from receiving telepathic communication. Those affected by this spell or that attempt to telepathically communicate with creatures under its effects are not innately aware that their communication is being inhibited. This spell temporarily disrupts spells and effects like telepathic bond or telepathic messages sent by a helm of telepathy, but not attacks and effects unrelated to communication like detect thoughts or a neothelid's psychic crush.","Demon Hunter's Handbook"
"Contact Nalfeshnee","divination","","","cleric/oracle 6, sorcerer/wizard 6, witch 6","1 round","V, S, M (powdered sapphire worth 250 gp), F (bejeweled cold iron mirror worth at least 2,000 gp)","1","personal","","","you","concentration","0","0","","","When you cast this spell, you fall into a trance and become helpless as long as you continue concentrating. Choose any one Knowledge skill other than arcana or planes. Your mind is placed in telepathic contact with a nalfeshnee demon skilled at that particular Knowledge skill, in addition to arcana and planes. Each round that you continue to concentrate, you may ask the nalfeshnee one question and it will answer as best it can. If you ask a question about arcana or planes, the nalfeshnee has a +23 bonus to the skill check. If you ask about the Knowledge skill you selected, the nalfeshnee has a +20 bonus. It cannot answer questions pertaining to other Knowledge skills-to do so, you must cast the spell again.  Contact with Abyssal minds is dangerous, and each time the nalfeshnee answers a question, you suffer 1d4 points of ability drain to Intelligence, Wisdom, or Charisma (determined randomly) unless you make a DC 22 Will save. Each additional question you ask with this spell over the course of a single 24-hour period imparts a cumulative -1 penalty on this saving throw. Chaotic evil spellcasters always gain a +4 bonus on this saving throw.","Demons Revisited"
"Ascension","universal","","","cleric/oracle 9, druid 9, sorcerer/wizard 9, witch 9, psychic 9","1 hour","V, S, F (minor artifact), M (10,000 gp in rare herbs, gems, and other exotic materials)","1","close (25 ft. + 5 ft./2 levels)","","","one non-mythic creature/3 levels","2 hours/level; see text","0","0","Will negates (harmless)","yes (harmless)","You imbue a number of creatures with mythic power, granting each of them 1st tier in a mythic path of its choice. The creatures immediately gain the benefits of their chosen paths. Divide the duration evenly among all targets.  The targets retain their mythic tier only while they're within 100 feet of the spell's focus component. A target that goes outside this range loses its mythic tier, but instantly regains it if it moves into range again. If the focus component is destroyed while the spell is in effect, the spell immediately ends and all targets gain 1d4 permanent negative levels.","Mythic Adventures"
"Bleed Glory","necromancy","","curse","cleric/oracle 3, sorcerer/wizard 3, witch 3, psychic 3, mesmerist 3, medium 1","1 standard action","V, S","0","close (25 ft. + 5 ft./2 levels)","","","one mythic creature","1 minute/level","0","0","Will negates","yes","The mythic power cost for all path abilities, feats, spells, and other effects used by the target increases by 1.","Mythic Adventures"
"Deathless","necromancy","","","alchemist 4, cleric/oracle 4, inquisitor 4, sorcerer/wizard 4, witch 4, psychic 4, medium 4","1 standard action","V, S","0","touch","","","living creature touched","1 round/level","0","0","Fortitude negates (harmless)","yes (harmless)","The target's soul is strongly anchored to its body, preventing death from hit point damage. No matter how low the target's hit points get, it remains alive (though not necessarily conscious).  This spell doesn't prevent death from sources other than hit point damage-such as Constitution damage or drain, death effects, or energy drain. Spells that cure hit points affect the creature normally.","Mythic Adventures"
"Lend Path","transmutation","","","bard 4, cleric/oracle 5, druid 5, magus 4, sorcerer/wizard 5, summoner/unchained summoner 4, witch 5, psychic 5, medium 2","1 standard action","V, S","0","touch","","","creature touched","10 minutes/level (D)","1","0","Will negates (harmless)","yes (harmless)","You temporarily transfer one of your mythic path abilities to another creature, which can use it as if it were part of the creature's own path. If the target is unable to expend mythic power, it can't activate any part of the ability that requires expending uses of mythic power, but the ability otherwise functions as if the creature were 1st tier.  While your path ability is transferred in this way, you can't use it yourself (even if it's an automatic ability or one that doesn't require expending uses of mythic power).","Mythic Adventures"
"Mythic Severance","necromancy","","curse","cleric/oracle 4, inquisitor 3, sorcerer/wizard 4, witch 4, psychic 4, mesmerist 3, medium 2","1 standard action","V, S","0","close (25 ft. + 5 ft./2 levels)","","","one creature","permanent","0","0","Will negates","yes","You restrict the target's access to its mythic power. Each time the target attempts to cast a mythic spell, expend mythic power to activate a path ability, or use any other effect that requires expending uses of mythic power, it must attempt a Will saving throw against the DC of this spell. If it fails this saving throw, the creature loses its action and the ability it was attempting to use has no effect.  This spell has no effect on mythic abilities that don't require the target to expend mythic power.","Mythic Adventures"
"Restore Mythic Power","transmutation","","","bard 3, cleric/oracle 3, sorcerer/wizard 3, witch 3, psychic 3, medium 2","1 standard action","V, S","0","touch","","","you and one mythic creature","instantaneous","0","0","Will negates (harmless)","yes (harmless)","By laying your hands on the target, you're able to transfer some of your mythic essence to the target. You expend three uses of your mythic power to restore one use of the target's mythic power.","Mythic Adventures"
"Share Glory","transmutation","","","bard 2, cleric/oracle 3, druid 3, sorcerer/wizard 3, summoner/unchained summoner 2, witch 3, psychic 3, medium 1","1 standard action","V, S","0","close (25 ft. + 5 ft./2 levels)","","","one non-mythic creature/3 levels","1 minute/level","0","0","Will negates (harmless)","yes (harmless)","You imbue the targets with a fraction of your mythic nature. They count as mythic creatures for the purpose of path abilities, spells, and other effects that function differently for mythic creatures. This doesn't grant the targets mythic tiers or any uses of mythic power; it merely gives them a greater advantage when others use abilities that work differently for mythic creatures. You must be at least a 1st-tier mythic character to cast this spell.","Mythic Adventures"
"Steal Power","necromancy","","","cleric/oracle 5, sorcerer/wizard 5, witch 5, psychic 5, mesmerist 4","1 standard action","V, S","0","close (25 ft. + 5 ft./2 levels)","","","one mythic creature","instantaneous","0","0","Will negates","yes","You sap the power from a mythic creature, using it to restore your own. The target loses 1d4 uses of mythic power. If you have the ability to expend mythic power, you regain one use for each use the target loses.","Mythic Adventures"
"Terraform","transmutation","","","cleric/oracle 7, druid 6, sorcerer/wizard 7, witch 7, psychic 7","1 hour","V, S, M (10,000 gp worth of precious minerals, see text)","1","100 feet","100-foot-radius emanation, centered on you","","","1 day/level (see text)","0","0","none","no","You alter the area's terrain and climate to a new terrain and climate type appropriate to the planet or plane. For example, you might transform a desert to plains. To cast this spell, you must expend 10 uses of mythic power along with the material cost. This magically alters the area's climate and normal plants to those appropriate to the new terrain, but doesn't affect creatures or the configuration of the earth. Transforming rocky hills into forested areas converts grasses into shrubs and small trees, but doesn't flatten the hills or change the animals to suit the new environment.  You can alter the climate by one step (warm, temperate, or cold). The maximum extent of the terrain change is up to the GM, but in general is to a similar terrain type or one step within that terrain type (such as from a typical forest to a forest with massive trees or light undergrowth, from a shallow bog to a deep bog, and so on). You might be able to shift the land to a similar terrain type, such as turning a sparse forest into a relatively dry swamp. Local creatures adversely affected by these alterations either flee the area or quickly die, depending on their mobility and awareness of the change.  Multiple castings of the spell in the same area can create an area with radically different terrain and climate than the surrounding land. The GM can decide that certain terrain shifts are unsustainable and shorten the duration, or that some are suitable for the area and extend the duration.  This spell could have many secondary effects based on the nature of the change, the type of bordering terrain, and so on; these should be determined by the GM on a case-by-case basis. For example, transforming a desert requires drawing water up from underground to sustain the plants, which could deplete the water table in nearby areas. Creating a warm desert in the middle of a snowy tundra will create a bordering area of mud and frequent storms from the clash of hot and cold air fronts.  If you're at least 8th tier, you can expend 20 uses of mythic power instead of 10 to increase the range to 1 mile, the area to a 1-mile-radius emanation centered on you, and the duration to 1 month per caster level.","Mythic Adventures"
"Apparent Treachery","enchantment","compulsion","mind-affecting","bard 3, inquisitor 3, sorcerer/wizard 4","1 standard action","V, S","0","close (25 ft. + 5 ft./2 levels)","","","one creature/level, no two of which can be more than 30 ft. apart","1 round/level (D)","1","0","Will negates","yes","You shroud a number of creatures in an aura of suspicion and fill them with extreme paranoia regarding their allies. Affected targets believe their companions are behaving erratically, nervously, and seemingly with an eye towards betrayal.  Creatures under the effect of apparent treachery do not have allies and are not considered to be an ally to any other creature, including other creatures affected by this spell. They cannot move freely through their allies' spaces, flank creatures with them, cooperate with them using teamwork feats, or give or receive benefits from the aid another action or any spells or effect that affects only allies. If creatures affected by this spell are able to take attacks of opportunity, they always do so against provoking opponents, including those who were their allies before being affected by this spell.  A creature not under the effects of the spell who is trying to cast a spell against an affected target must succeed at an attack roll to touch the target, even if the spell is harmless, though the affected creature is not forced to attempt saving throws against harmless effects.","AP 74"
"Film Of Filth","transmutation","","poison","cleric/oracle 4, druid 4, ranger 3, sorcerer/wizard 4","1 standard action","V, S","0","touch","","","creature touched","1 round/level (D)","1","0","Fortitude negates","yes","You cause the target's flesh to exude a layer of putrescent slime so foul that the target is sickened (Fortitude negates) for the duration of the spell and for 1d4 rounds thereafter. All creatures within 20 feet also become sickened (Fortitude negates), and remain sickened for as long as they remain within 20 feet of the target and for 1d4 rounds thereafter. A creature that strikes the target with a bite attack must succeed at an additional save or become nauseated for 1d4 rounds. Creatures immune to poison are unaffected.","AP 74"
"Lightning Lash","evocation","","electricity","cleric/oracle 3, inquisitor 3, ranger 2, witch 3","1 standard action","V, S","0","personal","20-foot-radius spread","","","1 round/level (D)","1","0","Fortitude negates (harmless)","yes","You create a crackling lash of unholy lightning that flickers and flashes in your hand like a whip, shifting color in response to your mood and will. Once per round, you can make a melee touch attack with the lightning lash against a target within 15 feet. If the attack is successful, it deals 1d6 points of electricity damage and 1d6 points of damage from divine power (similar to flame strike), and allows you to attempt a trip combat maneuver check as a free action against your target (using your caster level as your CMB).","AP 74"
